,Unnamed: 0.1,Unnamed: 0,title,tmdbid,rank,release_date,runtime,summary,genres,production,country,director,starring,poster_path,study_level
16,16,41,The Wolf of Wall Street,106646,8.034,2013-12-25,180,"A New York stockbroker refuses to cooperate in a large securities fraud case involving corruption on Wall Street, corporate banking world and mob infiltration. Based on Jordan Belfort's autobiography.","Crime, Drama, Comedy",Red Granite Pictures,United States of America,Martin Scorsese,"Aya Cash, Jamel Daniels, Johnathan Tchaikovsky, Cristin Milioti, Shea Whigham, J.C. MacKenzie, Julian Brand, Martin Klebba, Rick Bolander, John Behlmann, Vitaliy Shtabnoy, Ben Van Bergen, Ethan Suplee, Chris Nunez, Will MacAdam, Derek Milman, Aaron Lazar, Dierdre Reimold, Adria Baratta, Rémy Bennett, Blago Simon, Natasha Kojic, Tracy Friedman, Spenser Granese, Marcos A. Gonzalez, Justin Yllanes, Lawrence Lau, Donnie Keshawarz, Shea Coleman, Johnnie Mae, Michael Dubuc, Charley Morgan, Victor Verhaeghe, Matte Osian, Jonah Hill, Chris Matesevac, Spike Jonze, Jeremy Bobb, David Wenzel, Claudette Lalí, Brian Charles Johnson, Gregory Perri, Giselle Eisenberg, José Ramón Rosario, Margot Robbie, Madeleine Wade, Jared Houseman, Emily Tremaine, Jeff Moffitt, Kyle Chandler, Michael Power, Bryan Burton, Hardy Winburn, Edward Herrmann, Tess Olivia, Dan Hunter, Sharon Jones, Tommy Bayiokos, J.T. O'Connor, Joe Zaso, Ellen Sexton, Brian Sacca, Gianni Biasetti Jr., Brendan Griffin, Kerry Malloy, Stephanie Kurtzuba, Ted Griffin, Paul Jude Letersky, Starr Duncan-Lowe, Gregory Brown, Thomas Middleditch, Tucker Bryan, Ashley Blankenship, Chris Caldovino, Jamie O'Connell, London Hall, Stephen Kunken, Kenneth Choi, Rosemary Howard, Henry Zebrowski, Natasha Newman-Thomas, Loretta O. Booz, Steven Conroy, Natalie Bensel, Jon Spinogatti, Deema Aitken, Catherine Curtin, Geoffrey J.D. Payne, Fileena Bahris, Meghan Rafferty, Sibyl Santiago, Danny Flaherty, Silvia Kal, Mike Catapano, Michael Izquierdo, Ben Leasure, Jon Favreau, Dan Bittner, Dean Auer, Robert Clohessy, Ashlie Atkinson, Carla Corvo, Austin Farwell, Seregon O'Dassey, Matthew McConaughey, P.J. Byrne, Steve Witting, Leonardo DiCaprio, Matthew Rauch, Daniel Hepner, Mackenzie Meehan, Joseph Oliveira, Stefano Villabona, Steve Routman, Welker White, Zach Miko, Maria Di Angelis, Nicole Rutigliano, Katarina Čas, Garry Pastore, Krista Ashworth, Scott Nicholson, Barry Rothbart, Brian Tweedy, Paul Urcioli, Chris Kerson, Steven Boyer, Madison McKinley, Francis Brooke, Michael O'Hara, Joanna Lumley, Michael Bryan French, Jake Hoffman, Allyson Carr, Sebastian Tillinger, Bo Dietl, Viki Boyle, Ward Horton, Danny A. Abeckaser, Dan Daily, Justin Anthony Long, Tyler Evan Rowe, Ashley Springer, Louis Vanaria, Michael Nathanson, Christine Ebersole, Peter Youngblood Hills, Lawrence Smith, Sabina Maschi, Frank van Putten, Zana Markelson, Fran Lebowitz, Michael Jefferson, Bret Shuford, Kenneth Carrella, Paul Monte Jr., Ben Rameaka, Kathleen Fellegara, Jon Bernthal, Michael Devine, Aaron Glaser, Tom Greer, Saundra Williams, Judah McFadden, Ben Loving, John Bernard Martin, Jaclyn Keys, Jordan Belfort, Dustin Kerns, Jason Furlani, Kamron Leal, Jean Dujardin, Paul Thornton, Martin Scorsese, Sandra Nelson, Zineb Oukach, Chris Riggi, Rizwan Manji, Armen Garo, Rob Reiner, Christina Jeffs, Davram Stiefler, Kelsey Deanne",/34m2tygAYBGqA9MXKhRDtzYd4MR.jpg,B2
466,466,1433,Flipped,43949,8.021,2010-08-06,89,"When Juli meets Bryce in the second grade, she knows it's true love. After spending six years trying to convince Bryce the same, she's ready to give up - until he starts to reconsider.","Romance, Drama",Reiner / Greisman Productions,United States of America,Rob Reiner,"Cody H. Carolin, Morgan Lily, Kevin Weisman, Matthew Gold, Penelope Ann Miller, Shane Harper, Rebecca De Mornay, Callan McAuliffe, Stefanie Scott, Wallace Bridges, Ashley Taylor, Michael Bolten, Anthony Edwards, Madeline Carroll, Ryan Ketzner, Israel Broussard, Aidan Quinn, Patricia Lentz, John Mahoney, Inga R. Wilson",/6zDYFigohwncqFL00MKbFV01dWb.jpg,B2
138,138,380,American Beauty,14,8.017,1999-09-15,122,"Lester Burnham, a depressed suburban father in a mid-life crisis, decides to turn his hectic life around after developing an infatuation with his daughter's attractive friend.",Drama,DreamWorks Pictures,United States of America,Sam Mendes,"Lily Houtkin, Ara Celi, Scott Bakula, Chekesha Van Putten, James Hunter, Thora Birch, Fort Atkinson, Allison Janney, Erin Cathryn Strubbe, Wes Bentley, Nancy Anderson, Marissa Jaret Winokur, Dennis Anderson, Annette Bening, Spencer Kayden, Sue Casey, Joel McCrary, Tom Miller, Kevin Spacey, Brenda Wehle, John Cho, Lisa Cloud, Heather Joy Sher, Peter Gallagher, Bruce Cohen, Alison Faulk, Sam Robards, Carolina Lancaster, Matthew Kimbrough, Kent Faulcon, Barry Del Sherman, Amber Smith, Chris Cooper, Mona Leah, Mena Suvari, Stephanie Rizzo, Emily Zachary, Reshma Gajjar, Krista Goodsitt, Chelsea Hertford, Elaine Corral Kendall",/wby9315QzVKdW9BonAefg8jGTTb.jpg,C1
912,912,3122,Citizen Kane,15,8.007,1941-04-17,119,"Newspaper magnate Charles Foster Kane is taken from his mother as a boy and made the ward of a rich industrialist. As a result, every well-meaning, tyrannical or self-destructive move he makes for the rest of his life appears in some way to be a reaction to that deeply wounding event.","Mystery, Drama",Mercury Productions,United States of America,Orson Welles,"Richard Wilson, Edith Evanson, Carl Faulkner, Sonny Bupp, Charles Meakin, Dorothy Cleveland, William Alston, Carl Deloro, Clyde McAtee, Dorothy Comingore, Edmund Cobb, Leda Nicova, Ruth Warrick, Walter Sande, Al Eben, Morgan Brown, Jack Gwynne, Gus Schilling, Lillian Nicholson, Agnes Moorehead, Arthur Yeoman, Frank McLure, Ernest Grooney, Don Roberts, Ellen Lowe, Jesse Graves, Jack Gargan, Bud Geary, Victor Romito, Hercules Mendez, Gene Coogan, Larry Wheat, Field Norton, Bert Stevens, Louis Natheaux, Paul Stewart, Danny Borzage, Louise Franklin, Peter Gowland, Edward Peil Jr., Teddy Mangean, J.J. Clark, Jack Raymond, Joan Blair, Joseph North, Ray Collins, Ludwig Lowry, Robert Dudley, John McCormack, Bob Terry, Arthur O'Connell, Rudy Germane, Frances E. Neal, George DeNormand, Georgia Backus, Renee Godfrey, Eddie Coke, Finn Zirzow, Erskine Sanford, Art Dupuis, Bruce Sidney, Walter Bacon, Maurice Costello, Louise Currie, William Alland, Russ Powell, John Alban, Larry Williams, George Sherwood, Thomas Pogue, Tim Davis, Demetrius Alexis, Lillian O'Malley, Arthur Kay, Edna Mae Jones, Joseph Cotten, Robert Haines, Bryan 'Slim' Hightower, Tom Coleman, Walter Lawrence, Milton Kibbee, George W. Jimenez, Gohr Van Vleck, Gregg Toland, Gerald Pierce, Dona Dax, Walter James, Jimmy Grant, Jack Curtis, Dick Scott, Sam Harris, Francis Sayles, Thomas A. Curran, Irving Mitchell, Roland Winters, Mike Lally, Philip Morris, Suzanne Dulier, Fortunio Bonanova, Harry A. Bailey, Major McBride, Mickey Martin, Buddy Swan, Sam Ash, Orson Welles, Herbert Corthell, Gino Corrado, Carl Ekberg, Myrtle Rishell, Shimen Ruskin, Perc Launders, Tom Steele, Carmen Laroux, William H. O'Brien, Suzanne Ridgway, Harry J. Vejar, Sam Rice, Herman J. Mankiewicz, Jan Wiley, Terrance Ray, Buck Mack, Olin Francis, Landers Stevens, John Northpole, Philip Van Zandt, Alan Ladd, Don Ackerman, Sally Corner, Lew Harvey, Mitchell Ingraham, Eddie Dew, Juanita Fields, Benny Rubin, Paddy O'Flynn, George Noisom, Harry Burkhardt, Charles Bennett, Jack Egan, Harry Shannon, Johnny Eckert, Buddy Messinger, John Dilson, Henry Hebert, Tudor Williams, Everett Sloane, Edward Ryan, James T. Mack, George Coulouris, Bert Moorhouse, Guy Repp, Frank O'Connor, Cyril Ring, Jolane Reynolds, Bert LeBaron",/sav0jxhqiH0bPr2vZFU0Kjt2nZL.jpg,C1
772,772,2519,Casino,524,8.004,1995-11-22,179,"In early-1970s Las Vegas, Sam ""Ace"" Rothstein gets tapped by his bosses to head the Tangiers Casino. At first, he's a great success in the job, but over the years, problems with his loose-cannon enforcer Nicky Santoro, his ex-hustler wife Ginger, her con-artist ex Lester Diamond and a handful of corrupt politicians put Sam in ever-increasing danger.","Crime, Drama",Universal Pictures,France,Martin Scorsese,"Catherine Scorsese, L.Q. Jones, Millicent Sheridan, Frank Vincent, Joe Pesci, Alan King, C.C. Carr, Nobu Matsuhisa, Alfred Nittoli, Craig Vincent, Frankie Avalon, Joseph P. Reidy, Cathy Scorsese, Clem Caserta, Gene Ruffini, Carl Ciarfalio, Dick Smothers, Anthony Russell, Steve Schirripa, Daniel P. Conte, Madeline Parquette, Joseph Rigano, Frankie J. Allison, Steve Allen, Kevin Pollak, Ffolliott Le Coque, John Manca, Joey DePinto, Philip Suriano, Stuart Nisbet, David Rose, Peter Conti, Nick Mazzola, Jack Orend, Bill Allison, Jayne Meadows, Don Rickles, Frank Adonis, Pasquale Cajano, Joseph Bono, Erika von Tagen, John Bloom, Jed Mills, Claudia Haro, Vinny Vella, Joe La Due, Sharon Stone, Richard Riehle, Oscar Goodman, Jerry Vale, Robert De Niro, Ronald Maccone, James Woods, Dominick Grieco, Steve Vignari, Melissa Prophet, Paul Herman",/4TS5O1IP42bY2BvgMxL156EENy.jpg,C1
15,15,39,Toy Story,862,8.0,1995-10-30,81,"Led by Woody, Andy's toys live happily in his room until Andy's birthday brings Buzz Lightyear onto the scene. Afraid of losing his place in Andy's heart, Woody plots against Buzz. But when circumstances separate Buzz and Woody from their owner, the duo eventually learns to put aside their differences.","Animation, Adventure, Family, Comedy",Pixar,United States of America,John Lasseter,"Jan Rabson, Wallace Shawn, Sam Lasseter, Jim Varney, Penn Jillette, Spencer Aste, Kendall Cunningham, Jeff Pidgeon, Tracy Fraim, Jonathan Benair, Cody Dorkin, R. Lee Ermey, Tom Hanks, Bill Farmer, John Ratzenberger, Laurie Metcalf, Tim Allen, Brittany Levenbrown, Scott McAfee, Lisa Bradley, Sarah Freeman, John Morris, Erik von Detten, John Lasseter, Jack Angel, Mickie McGowan, Debi Derryberry, Phil Proctor, Joe Ranft, Greg Berg, Craig Good, Sherry Lynn, Andrew Stanton, Gregory Grudt, Shane Sweet, Don Rickles, Danielle Judovits, Annie Potts, Anthony Burch, Ryan O'Donohue, Patrick Pinney",/uXDfjJbdP4ijW5hWSBrPrlKpxab.jpg,A2
19,19,52,Harry Potter and the Prisoner of Azkaban,673,8.0,2004-05-31,141,"Year three at Hogwarts means new fun and challenges as Harry learns the delicate art of approaching a Hippogriff, transforming shape-shifting Boggarts into hilarity and even turning back time. But the term also brings danger: soul-sucking Dementors hover over the school, an ally of the accursed He-Who-Cannot-Be-Named lurks within the castle walls, and fearsome wizard Sirius Black escapes Azkaban. And Harry will confront them all.","Adventure, Fantasy",Warner Bros. Pictures,United Kingdom,Alfonso Cuarón,"Abby Ford, Lee Ingleby, Bronson Webb, Peter Best, Alan Rickman, Gary Oldman, David Bradley, Robbie Coltrane, Matthew Lewis, Devon Murray, Pam Ferris, Lenny Henry, Dawn French, Richard Griffiths, James Phelps, Genevieve Gaunt, Julie Walters, Josh Herdman, Jimmy Gardner, Violet Columbus, Robert Hardy, Ricky Sahota, Kandice Morris, Adrian Rawlins, Jim Tavaré, Chris Rankin, Bonnie Wright, Tom Ackerley, Emma Watson, Timothy Spall, Annalisa Bugliani, Oliver Phelps, Michael Gambon, Alfred Enoch, Rupert Grint, David Thewlis, Tess Bu Cuarón, Emma Thompson, Warwick Davis, Ekow Quartey, Tom Felton, Ian Brown, Jennifer Smith, Julie Christie, Sharon Sandhu, Freddie Davies, Marianne Chase, Harry Melling, Paul Whitehouse, Daniel Radcliffe, Fiona Shaw, Mark Williams, Danielle Tabor, Geraldine Somerville, Sitara Shah, Jamie Waylett, Maggie Smith",/aWxwnYoe8p2d2fcxOqtvAtJ72Rw.jpg,B2
114,114,325,The Imitation Game,205596,8.0,2014-11-14,113,"Based on the real life story of legendary cryptanalyst Alan Turing, the film portrays the nail-biting race against time by Turing and his brilliant team of code-breakers at Britain's top-secret Government Code and Cypher School at Bletchley Park, during the darkest days of World War II.","History, Drama, Thriller, War",Bristol Automotive,United States of America,Morten Tyldum,"Keira Knightley, David Charkham, Mark Underwood, Charles Dance, Stuart Matthews, Denis Khoroshko, Sam Exley, Tuppence Middleton, Daniel Chapple, Will Bowden, Leigh Dent, Richard Campbell, James Northcote, Andrew Havill, Laurence Kennedy, Rory Kinnear, Ancuta Breaban, Alexander Cooper, Dominic Charman, Grace Calder, Tom Goodman-Hill, James G. Nunn, Hayley Joanne Bacon, Ilan Goodman, Miranda Bell, Jack Tarlton, Jack Bannon, Victoria Wicks, Tim Steed, Nicola-Jayne Wells, Tim van Eyken, Mark Strong, Nicholas Blatt, Benedict Cumberbatch, Alex Lawther, Matthew Beard, Matthew Goode, David G. Robinson, Alex Corbet Burcher, Debra Leigh-Taylor, Josh Wichard, Allen Leech, Joseph Oliveira, Charlie Manton, Steven Waddington, Lisa Colquhoun",/zSqJ1qFq8NXFfi7JeIYMlzyR0dx.jpg,C2
122,122,345,The Sixth Sense,745,8.0,1999-08-06,107,"Following an unexpected tragedy, child psychologist Malcolm Crowe meets a nine year old boy named Cole Sear, who is hiding a dark secret.","Mystery, Thriller, Drama",Spyglass Entertainment,United States of America,M. Night Shyamalan,"Greg Wood, Tom McLaughlin, Kate Kearney-Patch, Bruce Willis, Bob Bowersox, Ronnie Lea, Heidi Fischer, Donnie Wahlberg, Wes Heywood, Mischa Barton, Kym Cohen, Jose L. Rodriguez, Colleen June McQuaide, Neill Hartley, Sean Oliver, Alison Robertson, Jonathan Nation, Bruce Norris, Glenn Fitzgerald, Lisa Summerour, Gina Allegro, Marilyn Shanok, Hayden Saunier, Sarah Ripard, Carlos Xavier Lopez, Gino Inverso, Firdous Bamji, Carol Nielson, Ellen Sheppard, Patrick McDade, Angelica Page, Toni Collette, Keith Woulard, Olivia Williams, Samantha Fitzpatrick, Haley Joel Osment, Peter Anthony Tambakis, Candy Aston-Dennis, Holly Cross Vagley, Matt Casale, M. Night Shyamalan, Jodi Dawson, Jeffrey Zubernis, KaDee Strickland, Tony Michael Donnelly, Samia Shoaib, Nico Woulard, Janis Dardaris, Trevor Morgan, Michael J. Lyons",/4AfSDjjCy6T5LA1TMz0Lh2HlpRh.jpg,C1
206,206,592,Kill Bill: Vol. 1,24,8.0,2003-10-10,111,"An assassin is shot by her ruthless employer, Bill, and other members of their assassination circle – but she lives to plot her vengeance.","Action, Crime",Miramax,United States of America,Quentin Tarantino,"Vivica A. Fox, Sachiko Fujii, Hu Xiaohui, Yoji Tanaka, Zhang Jinzhan, Jun Kunimura, Naomi Kusumi, Yuki Kazamatsuri, Sonny Chiba, Tetsuro Shimaguchi, Akaji Maro, Hikaru Midorikawa, Ronnie Yoshiko Fujiyama, Lucy Liu, Julie Dreyfus, Michael Parks, Shun Sugata, James Parks, Kenji Ohba, Issey Takahashi, Yoshiyuki Morishita, Kazuki Kitamura, Juri Manase, Ambrosia Kelley, Michael Madsen, Ai Maeda, Gordon Liu Chia-hui, Daryl Hannah, Chiaki Kuriyama, Uma Thurman, Yoshiko Yamaguchi, Sō Yamanaka, Michael Bowen, Sakichi Sato, Goro Daimon, David Carradine, Shu Lan Tuan, Jonathan Loughran",/v7TaX8kXMXs5yFFGR41guUDNcnB.jpg,B2
344,344,1019,Jojo Rabbit,515001,8.0,2019-10-18,108,"A World War II satire that follows a lonely German boy whose world view is turned upside down when he discovers his single mother is hiding a young Jewish girl in their attic. Aided only by his idiotic imaginary friend, Adolf Hitler, Jojo must confront his blind nationalism.","Comedy, War, Drama",Fox Searchlight Pictures,New Zealand,Taika Waititi,"Hardy Griffin Davis, Issy Stewart, Alfie Allen, Bethany Adams, Brian Caspe, Archie Yates, Sam Rockwell, Thomasin McKenzie, Stanislav Callas, Rebel Wilson, Billy Rayner, Judith Georgi, Gilby Griffin Davis, Taika Waititi, Joe Weintraub, Gabriel Andrews, Victoria Hogan, Trish Osmond, Christian Howlings, Matej Seifert, Robert East, James McVan, Roman Griffin Davis, Iva Šindelková, Curtis Matthew, Stephen Merchant, Samuel Bogner, Odeta Cali, Scarlett Johansson, Luke Brandon Field, Sam Haygarth",/7GsM4mtM0worCtIVeiQt28HieeN.jpg,B2
393,393,1182,The Grand Budapest Hotel,120467,8.0,2014-02-26,100,"The Grand Budapest Hotel tells of a legendary concierge at a famous European hotel between the wars and his friendship with a young employee who becomes his trusted protégé. The story involves the theft and recovery of a priceless Renaissance painting, the battle for an enormous family fortune and the slow and then sudden upheavals that transformed Europe during the first half of the 20th century.","Comedy, Drama",Fox Searchlight Pictures,Germany,Wes Anderson,"Jeff Goldblum, Dirk Bossmann, Matthias Holfert, Dar Ronge, Fisher Stevens, Steffen Scheumann, Jenő Orosz, Daniel Steiner, Gyula Lukács, Philipp Sonntag, Marcel Mazur, Michaela Caspar, Hans Martin Stier, Roman Berger, Edward Norton, Sabine Euler, Ursula Kuhnt, Georg Tryphon, Gerald Sullivan, Paul Schlase, Volker Michalowski, Uwe Holoubek, David Adamik, Willem Dafoe, Heinz-Werner Jeschkowski, Heike Hanold-Lynch, Robin Hurlstone, Arwin Lobedann, Ralph Fiennes, Harvey Keitel, Matthias Matschke, Tilda Swinton, Lucas Hedges, Rainer Reiners, Darin Damjanow, Oliver Claridge, Jude Law, Ben Howard, F. Murray Abraham, Birgit Müller, Steffen Nixdorf, Piet Paes, Bob Balaban, Bohumil Váchal, Golo Euler, Manfred Lindner, Giselda Volodi, Hendrik von Bültzingslöwen, Milton Welsh, Oliver Hazell, Waris Ahluwalia, Sister Anna Rademacher, Roy Macready, Francesco Zippel, Léa Seydoux, Wolfgang Czeczor, Monika Krüger, Tony Revolori, Jutta Westphal, Saoirse Ronan, Gabriel Rush, Bill Murray, Karl Markovics, Manpreet Gerlach, John Peet, Hannes Wegener, Tom Wilkinson, Mathieu Amalric, Carl Sprague, Enrico Hoffmann, Georg Rittmannsperger, Larry Pine, Sabine Urig, Alfred Hänel, Jürgen Schwämmle, Jason Schwartzman, Renate Klein, Lisa Kreuzer, David Cioffi, Reinhold Hegelow, Marko Dyrlich, Owen Wilson, Michael Benthin, Marie Goyette, Wallace Wolodarsky, Gisela Bech, Robert Bienas, Neal Huff, Moritz Hepper, Florian Lukas, Jella Niemann, Wolfram Nielacny, Adrien Brody, Kunichi Nomura, Frank Jacob, Bernhard Kremser, Ed Munro, Lennart Meyer",/eWdyYQreja6JGCzqHWXpWHDrrPo.jpg,B1
402,402,1205,North by Northwest,213,8.0,1959-07-08,136,"Advertising man Roger Thornhill is mistaken for a spy, triggering a deadly cross-country chase.","Thriller, Adventure",Metro-Goldwyn-Mayer,United States of America,Alfred Hitchcock,"Nora Marlowe, Doreen Lang, Walter Coy, Les Tremayne, James Mason, Stuart Holmes, Patricia Cutts, Robert Shayne, Ned Glass, Robert Haines, Patrick McVey, Bert Stevens, Philip Coolidge, Carl M. Leviness, Carl Milletaire, Eugene Jackson, Jessie Royce Landis, Colin Kenny, Adolph Faylauer, Dale Van Sickel, Harry Seymour, Arthur Tovey, Robert Ellenstein, Bobby Johnson, Lawrence Dobkin, Frank Marlowe, Tommy Farrell, Alphonso DuBois, Cary Grant, John Damler, Frank Wilcox, Tom Greenway, Wilson Wood, Maura McGiveney, Malcolm Atterbury, Ralph Reed, Leo G. Carroll, Tol Avery, Jimmy Cross, Dick Johnstone, Stuart Hall, Philip Ober, Ken Lynch, Brandon Beach, Alfred Hitchcock, James Gonzalez, Harvey Stephens, Harry Strang, Lloyd Williams, Stanley Adams, Sally Fraser, Madge Kennedy, Baynes Barron, Steve Carruthers, Thomas Martin, Jack Daly, Taggart Casey, Alexander Lockwood, Jeffrey Sayre, Eva Marie Saint, John Beradino, Josephine Hutchinson, Andy Albin, Cosmo Sardo, Robert B. Williams, Maudie Prickett, Bill Catching, James McCallion, Len Hendry, Adam Williams, Finn Zirzow, Don Anderson, Howard Negley, Edward Binns, Olan Soule, Paula Winslowe, Carleton Young, John Roy, Paul Genge, Rama Bai, Edward Platt, Martin Landau, Scott Seaton, Anne Anderson, Helen Spring, Hans Moebus, Jeremy Slate, Bess Flowers, Ernest Anderson, Jesslyn Fax, Kenner G. Kemp, Monty O'Grady",/8gvfRlVpcKaTVqipXpYOGWBN1aO.jpg,C1
504,504,1549,Lawrence of Arabia,947,8.0,1962-12-11,228,"The story of British officer T.E. Lawrence's mission to aid the Arab tribes in their revolt against the Ottoman Empire during the First World War. Lawrence becomes a flamboyant, messianic figure in the cause of Arab unity but his psychological instability threatens to undermine his achievements.","Adventure, History, War",Horizon Pictures,United Kingdom,David Lean,"George Spence, John Robinson, Mohamed El Habachi, Michel Ray, Donald Wolfit, George Plimpton, John Dimech, Jack Hedley, Ernie Rice, Graham Tonbridge, Gamil Ratib, Alec Guinness, Henry Oscar, Jack Gwillim, Arthur Kennedy, Basil Dignam, Steve Birtles, Stuart Saunders, Roy Stevens, Anthony Quinn, Peter Dukelow, John Barry, Peter O'Toole, John Bennett, Robert Bolt, David Lean, Daniel Moynihan, J.R.M. Chapman, James Hayter, Barbara Cole , Bryan Pringle, Clive Morton, Kenneth Fortescue, John Ruddock, Robert Rietti, Bruce Beeby, Howard Marion-Crawford, Norman Rossington, Barry Warren, Anthony Quayle, Zia Mohyeddin, Patrick Kavanagh, José Ferrer, I.S. Johar, Noel Howlett, Jack Hawkins, Claude Rains, Peter Burton, Ian MacNaughton, Harry Fowler, Jack Sharp, Cyril Shaps, Fred Bennett, Rafael Hernández, Fernando Sancho, Omar Sharif, Hugh Miller",/AiAm0EtDvyGqNpVoieRw4u65vD1.jpg,C2
535,535,1644,Before Sunrise,76,8.0,1995-01-27,101,"A young man and woman meet on a train in Europe, and wind up spending one evening together in Vienna. Unfortunately, both know that this will probably be their only night together.","Drama, Romance",Castle Rock Entertainment,Austria,Richard Linklater,"Hanno Pöschl, Bilge Jeschim, Peter Ily Huemer, Erni Mangold, Georg Schöllhammer, Kurti, Julie Delpy, Alexandra Seibel, Wolfgang Glüxam, Branko Andrić 'Andrla', Christian Ankowitsch, Karl Bruckschwaiger, Otto Reiter, Tex Rubinowitz, Paul Poet, Richard Linklater, Dominik Castell, Wilbirg Reiter, Ethan Hawke, John Sloss, Wolfgang Staribacher, Andrea Eckert, Constanze Schweiger, Hubert Fabian Kulterer, Liese Lyon, Barbara Klebel, Harold Waiglein, Hans Weingartner, Haymon Maria Buttinger, Adam Goldberg",/kf1Jb1c2JAOqjuzA3H4oDM263uB.jpg,B2
635,635,1982,The Great Escape,5925,8.0,1963-07-03,173,"The Nazis, exasperated at the number of escapes from their prison camps by a relatively small number of Allied prisoners, relocate them to a high-security 'escape-proof' camp to sit out the remainder of the war. Undaunted, the prisoners plan one of the most ambitious escape attempts of World War II. Based on a true story.","Adventure, Drama, War",The Mirisch Company,United States of America,John Sturges,"Robert Freitag, Ulrich Beiger, Robert Desmond, William Russell, Jud Taylor, Hannes Messemer, Angus Lennie, Charles Bronson, David McCallum, James Donald, John Leyton, James Coburn, Nigel Stock, Robert Graf, Steve McQueen, Heinz Weiss, Hans Reiser, Gordon Jackson, Richard Attenborough, George Mikell, James Garner, Donald Pleasence, Tom Adams, Lawrence Montaigne, Karl-Otto Alberty, Til Kiwe, Harry Riebauer",/gBH4H8UMFxl139HaLz6lRuvsel8.jpg,C1
779,779,2540,Amadeus,279,8.0,1984-09-19,160,Disciplined Italian composer Antonio Salieri becomes consumed by jealousy and resentment towards the hedonistic and remarkably talented young Viennese composer Wolfgang Amadeus Mozart.,"History, Music, Drama",The Saul Zaentz Company,United States of America,Miloš Forman,"Deborah Rees, Miroslav Sekera, Zdeněk Sklenář, Jan Pohan, Patricia Payne, Samuel Ramey, Mary Ann Kellogg, Lenka Loubalová, Roderick Cook, Herman Meckler, Vladimír Krouský, John Malashock, Jeffrey Jones, Eva Šenková, Roy Dotrice, Simon Callow, Karel Engel, Dagmar Mašková, Milan Demjanenko, Jan Kuželka, Pavel Nový, Tom Hulce, Cynthia Nixon, Jiří Vančura, Dana Vávrová, Aťka Janoušková, Jiří Lír, Lubomír Havlák, Miriam Chytilová, Elizabeth Berridge, Martin Cavani, Ivan Pokorný, Shelley Freydont, Richard Colton, Alexander Oliver, Karel Fiala, Viktor Maurer, Felicity Lott, Brian Kay, John Carrafa, Patrick Hines, Willard White, Lisbeth Bartlett, Jan Blažek, Jaroslav Mikulín, Hana Brejchová, Charles Kay, Josef Zeman, Anne Glasner, Helena Cihelníková, Brian Pettifer, Karel Gult, Vincent Schiavelli, Jennifer Rawe, Karl-Heinz Teuber, Radka Kuchařová, Richard Frank, Zbyněk Bruthans, Renata Vacková, Petra Vogelová, Magda Čelakovská, Vladimír Svitáček, Zdeněk Mahler, Tereza Pokorná-Herzová, Douglas Seale, Vojtěch Nalezenec, Karel Hábl, Jonathan Moore, June Anderson, Zdeněk Jelen, Jiří Opsatko, William Whitener, Karel Effa, René Gabzdyl, Radka Fidlerová, F. Murray Abraham, Jitka Molavcová, Jiří Krytinář, Gino Zeman, Slavěna Drášilová, Marta Jarolímková, Isobel Buchanan, Miro Grisa, Robin Leggate, Raymond Kurshals, Ladislav Mikeš, Milada Čechalová, Antonín Kramerius, Barbara Bryne, Gabriela Krčková, Sara Clifford, Philip Lenkowsky, Christine Ebersole, Milan Riehs, Anne Howells, Tom Rawe, Peter DiGesu, John Tomlinson, Leoš Kratochvíl, Zuzana Kadlecová, Ladislav Krečmer, Nicholas Kepros, Iva Šebková, John Strauss, Jana Musilová, Richard Stilwell, Suzanne Murphy, Gillian Fisher, Kenny Baker, Barbara Hoom",/1n5VUlCqgmVax1adxGZm8oCFaKc.jpg,C1
