,Unnamed: 0.1,Unnamed: 0,title,tmdbid,rank,release_date,runtime,summary,genres,production,country,director,starring,poster_path,study_level
1187,1187,4856,Moonrise Kingdom,83666,7.7,2012-05-16,94,"Set on an island off the coast of New England in the summer of 1965, Moonrise Kingdom tells the story of two twelve-year-olds who fall in love, make a secret pact, and run away together into the wilderness. As various authorities try to hunt them down, a violent storm is brewing off-shore – and the peaceful island community is turned upside down in more ways than anyone can handle.","Comedy, Drama, Romance",Indian Paintbrush,United States of America,Wes Anderson,"Liz Callahan, Frances McDormand, Andreas Sheikh, Wyatt Ralff, Bruce Willis, Hugo DeAscentis, Max Derderian, Tilda Swinton, Marianna Bassham, Bill Murray, Alex Milne, Jason Schwartzman, Eric Chase Anderson, Tommy Nelson, Kara Hayward, Seamus Davey-Fitzpatrick, Lucas Hedges, Preston Hatch, Chandler Frantz, Steve Smith, Caris Yeoman, Ben Haffner, Gabriel Rush, Michael Malvesti, Derek Sardella, James Demler, Ada-Nicole Sanger, John Peet, Christine Noel, Larry Pine, Neal Huff, Lily Tiger McEnerney, Cooper Murray, Jordan Puzzo, Rob H. Campbell, Bob Balaban, Jack Lescoulie, Jared Gilman, Dakota Pimentel, Tanner Flood, Harvey Keitel, Kevin DeCoste, Tyler Metivier, Coledyn Garrow, Johnathon Deneault, Jean-Michael Pion, John Franchi, Edward Norton, Violet Guinness, Roman Keitel, Al Conti, Carolyn Pickman, Richie Conant, Charlie Kilgore, Jake Ryan, Isabella Guinness, L.J. Foley",/xrziXRHRQ7c7YLIehgSJY8GQBsx.jpg,B1
1286,1286,5520,Strangers on a Train,845,7.7,1951-06-27,101,"Having met on a train, a smooth-talking psychotic socialite shares his theory on how two complete strangers can get away with murder to an amateur tennis player — a theory he plans to test out.","Crime, Thriller",Warner Bros. Pictures,United States of America,Alfred Hitchcock,"Jonathan Hale, Alfred Hitchcock, John Doucette, Oliver Cross, Marion Lorne, Norma Varden, Brooks Benedict, Ruth Roman, Harry Hines, Leo G. Carroll, Patricia Hitchcock, Robert Walker, Stuart Hall, John Brown, Kasey Rogers, Farley Granger, Paul McGuire, Tom Ferrandini, Robert Gist, Howard St. John",/ihC083U7ef56Ui4x0P0dobojrZ1.jpg,C1
1352,1352,6073,The Maltese Falcon,963,7.7,1941-10-18,100,"A private detective takes on a case that involves him with three eccentric criminals, a beautiful liar, and their quest for a priceless statuette.","Mystery, Crime, Thriller",Warner Bros. Pictures,United States of America,John Huston,"Walter Huston, Creighton Hale, Emory Parnell, William Hopper, Peter Lorre, John Hamilton, Ward Bond, Gladys George, Elisha Cook Jr., Murray Alper, Jerome Cowan, Chester Gan, Charles Drake, Barton MacLane, Mary Astor, Jack Mower, Sydney Greenstreet, James Burke, Hank Mann, Lee Patrick, Humphrey Bogart, Robert Homans",/bf4o6Uzw5wqLjdKwRuiDrN1xyvl.jpg,C1
1611,1611,9079,Harvey,11787,7.7,1950-12-04,104,"The story of Elwood P. Dowd who makes friends with a spirit taking the form of a human-sized rabbit named Harvey that only he sees (and a few privileged others on occasion also.) After his sister tries to commit him to a mental institution, a comedy of errors ensues. Elwood and Harvey become the catalysts for a family mending its wounds and for romance blossoming in unexpected places.","Comedy, Fantasy",Universal International Pictures,United States of America,Henry Koster,"Harvey, James Stewart, Norman Leavitt, Fess Parker, Josephine Hull, Wallace Ford, Charles Drake, Grayce Mills, Clem Bevans, Eula Guy, Jesse White, Maudie Prickett, Don Brodie, Pat Flaherty, Victoria Horne, Cecil Kellaway, Peggy Dow, Dick Wessel, William H. Lynn, Nana Bryant",/dgd82hYmpiXDM1G867HqNaWe8wj.jpg,B1
1686,1686,10272,The Hustler,990,7.7,1961-09-25,134,Fast Eddie Felson is a small-time pool hustler with a lot of talent but a self-destructive attitude. His bravado causes him to challenge the legendary Minnesota Fats to a high-stakes match.,"Drama, Romance",Rossen Films,United States of America,Robert Rossen,"Paul Newman, Michael Constantine, Gordon B. Clarke, Vincent Gardenia, Jackie Gleason, Murray Hamilton, Clifford A. Pellow, Alexander Rose, Willie Mosconi, Jake LaMotta, Carolyn Coates, Myron McCormick, Stefan Gierasch, Carl York, George C. Scott, Piper Laurie",/snItsSViawjaadW9mlWUmGwR41R.jpg,B2
1826,1826,14368,An Adventure in Space and Time,210024,7.7,2013-11-21,83,"Actor William Hartnell felt trapped by a succession of hard-man roles while wannabe producer Verity Lambert was frustrated by the TV industry's glass ceiling. Both of them were to find unlikely hope and unexpected challenges in the form of a Saturday tea-time drama. Allied with a team of unusual but brilliant people, they went on to create the longest running science fiction series ever made.",Drama,BBC,United Kingdom,Terry McDonough,"Sacha Dhawan, Ellie Spicer, Nicholas Briggs, Jessica Raine, Sam Hoare, Anna-Lisa Drew, Sarah Winter, Brian Cox, Lesley Manville, Jemma Powell, Carole Ann Ford, Kit Connor, Joseph Railton, Ian Hallard, Reece Shearsmith, Cara Jenkins, Jamie Glover, David Annen, Mark Eden, William Russell, Jeff Rawle, Matt Smith, William Hartnell, Robin Varley, Sophie Holt, Toby Hadoke, Claudia Grant, Andrew Woodall, David Bradley, Edmund C. Short, Reece Pockney",/uqoVZo91qtU0Q2QnogYp4pNg7HJ.jpg,C1
1312,1312,5744,Little Miss Sunshine,773,7.694,2006-07-26,102,"A family loaded with quirky, colorful characters piles into an old van and road trips to California for little Olive to compete in a beauty pageant.","Comedy, Drama",Big Beach,United States of America,"Jonathan Dayton, Valerie Faris","Jerry Giles, Maliah Hudson, Greg Kinnear, Beth Grant, Mel Rodriguez, Brenae Bandy, Paula Newsome, Sydni Stevenson-Love, Lindsey Jordan, Kristen Holaas, Shane Murphy, Alissa Anderegg, Steven Christopher Parker, Dean Norris, Marc Turtletaub, Alexandria Alaman, Lauren Yee, Paul Dano, Gordon Thomson, Destry Jacobs, Wallace Langham, Bryan Cranston, Casandra Ashe, Annabelle Roberts, Julio Oscar Mechoso, Geoff Meed, Alan Arkin, Chuck Loring, Steve Carell, John Walcutt, Brittany Baird, Nicole Stoehr, Justin Shilton, Brenda Canela, Lauren Shiohama, Joan Scheckel, Abigail Breslin, Jill Talley, Toni Collette, Cambria Baird, George W. Bush, Mary Lynn Rajskub, Matt Winston, Terry Bolo",/wKn7AJw730emlmzLSmJtzquwaeW.jpg,B1
153,153,413,Black Swan,44214,7.687,2010-12-03,109,"The story of Nina, a ballerina in a New York City ballet company whose life, like all those in her profession, is completely consumed with dance. She lives with her retired ballerina mother Erica who zealously supports her daughter's professional ambition. When artistic director Thomas Leroy decides to replace prima ballerina Beth MacIntyre for the opening production of their new season, Swan Lake, Nina is his first choice.","Drama, Thriller, Horror",Fox Searchlight Pictures,United States of America,Darren Aronofsky,"Charlotte Aronofsky, Olga Kostritzky, Toby Hemingway, Sebastian Stan, Natalie Portman, Mark Margolis, Alexandra Damiani, Geneviève Lebean, Sergio Torrado, Tim Lacatena, Marcia Jean Kurtz, Holly L. Fusco, Marty Krzywonos, Deborah Offner, Christine Redpath, Mila Kunis, Barette Vance, Lauren Fadeley, Jamie Wolf, Benjamin Millepied, Janet Montgomery, Alyson Cambridge, Kurt Froman, Marina Stavitskaya, Carrie Lee Riggins, Leslie Lyles, Liam Flaherty, Sarah Hay, Kaia A. Tack, John Epperson, Anne Bergstedt Jordanova, Ksenia Solo, Abraham Aronofsky, Winona Ryder, Vincent Cassel, Arkadiy Figlin, Patrick Heusinger, Rebecca Azenberg, Laura Bowman, Lillian di Piazza, Stanley B. Herman, Gina Artese, Chris Gartin, Rachel Jambois, Tim Fain, Megan Dickinson, Kristina Anapau, Michelle Rodriguez Nouel, Jessy Hendrickson, Barbara Hershey, Sarah Lane, Adrianna de Svastich, Shaun O'Hagan, Tina Sloan, Ryoko Sadoshima, Daralina Komar, Abigail Mentzer",/rH19vkjAzCZ0HIUvrgB3rowm68h.jpg,C1
1474,1474,7310,Charade,4808,7.687,1963-12-01,113,"After Regina Lampert falls for the dashing Peter Joshua on a skiing holiday in the French Alps, she discovers upon her return to Paris that her husband has been murdered. Soon, she and Peter are giving chase to three of her late husband's World War II cronies, Tex, Scobie and Gideon, who are after a quarter of a million dollars the quartet stole while behind enemy lines.","Comedy, Mystery, Romance",Stanley Donen Films,United States of America,Stanley Donen,"Chantal Goya, James Coburn, Albert Daumergue, Claudine Berg, Bernard Musson, George Kennedy, Cary Grant, Louis Viret, Stanley Donen, Ned Glass, Marc Arian, Audrey Hepburn, Marcel Bernier, Monte Landis, Raoul Delfosse, Dominique Minot, Jacques Préboist, Clément Harari, Jean Gold, Roger Trapp, Antonio Passalia, Jacques Marin, Paul Bonifas, Michel Thomass, Peter Stone, Thomas Chelimsky, Walter Matthau",/ijJ73UgR6nOqjSP8MO0Z7hawCdm.jpg,B1
192,192,547,The Blind Side,22881,7.678,2009-11-20,129,"The story of Michael Oher, a homeless and traumatized boy who became an All American football player and first round NFL draft pick with the help of a caring woman and her family.",Drama,Alcon Entertainment,United States of America,John Lee Hancock,"John Henry Hancock, Sharon Conley, Michael Fisher, Tommy Tuberville, Jaye Tyroff, L. Warren Young, Matthew Atkinson, Afemo Omilami, Hampton Fluker, Maria Howell, Sandra Bullock, Brian Hollan, Ashley LeConte Campbell, Robert Pralgo, Destiny Long, John Newberg, Paul Amadi, Libby Whittemore, Catherine Combs, Jody Thompson, Franklin ""Pepper"" Rodgers, Joe Chrest, Trey Best, Eaddy Mays, Tom Nowicki, Omid Soltani, Kelly Johns, Eric Benson, Lily Collins, Phillip Fulmer, Lou Holtz, Andy Stahl, Omar J. Dorsey, Irone Singleton, Preston Wigasi Brant, Catherine Dyer, Ed Orgeron, David Dwyer, Kim Dickens, Whitney Branan, Brett Rice, Ben Keen, Patrick G. Keenan, Stacey Turner, Ray McKinnon, Tim McGraw, Adriane Lenox, Rhoda Griffis, Tom Lemming, Kathy Bates, April Rich, Brandon Rivers, James Donadio, Elizabeth Omilami, Melody Weintraub, Kevin Nichols, Rachel St. Gelais, Lamont Koonce, Houston Nutt, Jae Head, Brian Sutherin, Nick Saban, Quinton Aaron",/bMgq7VBriuBFknXEe9E9pVBYGZq.jpg,C1
1423,1423,6740,High Noon,288,7.673,1952-06-09,85,"Will Kane, the sheriff of a small town in New Mexico, learns a notorious outlaw he put in jail has been freed, and will be arriving on the noon train. Knowing the outlaw and his gang are coming to kill him, Kane is determined to stand his ground, so he attempts to gather a posse from among the local townspeople.","Western, Thriller",Stanley Kramer Productions,United States of America,Fred Zinnemann,"Ben Corbett, Lucien Prival, Allen D. Sewall, Harry Shannon, Howland Chamberlain, William Phillips, Morgan Farley, Ian MacDonald, Chuck Hayward, Thomas Mitchell, Harry Morgan, Gary Cooper, Katy Jurado, Lee Aaker, Herschel Graham, Roy Bucko, James Millican, Lee Van Cleef, Guy Beach, John Doucette, Robert J. Wilke, Grace Kelly, Ann Kunde, Virginia Farmer, William Newell, Merrill McCormick, Otto Kruger, Jack Montgomery, Cliff Clark, Tim Graham, Charles Soldani, Virginia Christine, Nolan Leary, Paul Kruger, Larry J. Blake, Jack Elam, Dick Elliott, Lon Chaney Jr., John Breen, Nora Bush, Slim Talbot, Paul Dubov, Lloyd Bridges, Tom Greenway, Buddy Roosevelt, Harry Harvey, Michael Jeffers, Rudy Germane, Tom London, Tex Driscoll, Ralph Reed, Sheb Wooley, Kansas Moehring, Ted Stanhope, Russell Custer, William H. O'Brien, Eve McVeagh",/m3EzjFuSK49woacPF1PyHcNM39B.jpg,C1
724,724,2296,Breakfast at Tiffany's,164,7.666,1961-10-06,115,"Holly Golightly is an eccentric New York City playgirl determined to marry a Brazilian millionaire. But when young writer Paul Varjak moves into her apartment building, her past threatens to get in their way.","Comedy, Romance, Drama",Paramount Pictures,United States of America,Blake Edwards,"John Perri, Roydon Clark, Florine Carlan, Annabella Soong, Arthur Berkeley, Thayer Burton, Miriam Nelson, Paul Lees, Fay McKenzie, Joe Gray, Tom Curtis, Beverly Powers, Elvia Allman, Martin Balsam, Sue Casey, Dorothy Whitney, Bill Neff, Harold Miller, Joyce Meadows, Helen Spring, Henry Barnard, Willie Bloom, Charles Sherlock, Mel Leonard, Dick Crockett, Peggy Patten, Wilson Wood, Mary LeBow, Joseph Glick, Nino Tempo, Glen Vernon, Sam Harris, Frank Kreig, Kate Murtagh, Michael Zaslow, Mike Mahoney, Joe Scott, Janet Banzet, Nicky Blair, Chuck Niles, George Peppard, Al Avalon, Buddy Ebsen, Henry Beckman, Stanley Adams, Tommy Farrell, Jim Michael, Joan Staley, Leatrice Leigh, Linda Wong, Marian Collier, Barbara Kelley, Towyna Thomas, John McGiver, Alan Reed, Christine Corbin, Joseph J. Greene, Leota Lorraine, Hollis Morrison, Audrey Hepburn, Gil Lamb, Hanna Landy, Kip King, Richard Wyler, James Lanphier, Robert Patten, Patricia Neal, Michael Quinlivan, Frank Marth, William Benegal Rau, Bill Bradley, Pete Kellett, Tony Regan, William Meader, Don Anderson, James Field, Claude Stroud, George Fields, José Luis de Vilallonga, Danny Truppi, Mickey Rooney, Mel Blanc",/79xm4gXw4l7A5D0XukUOJRocFYQ.jpg,B1
242,242,727,Jaws,578,7.664,1975-06-20,124,"When the seaside community of Amity finds itself under attack by a dangerous great white shark, the town's chief of police, a young marine biologist, and a grizzled hunter embark on a desperate quest to destroy the beast before it strikes again.","Horror, Thriller, Adventure",Zanuck/Brown Productions,United States of America,Steven Spielberg,"Rex Trailer, Jay Mello, Jeffrey Voorhees, Steven Spielberg, Robin Lebert, Fritzi Jane Courtney, Roy Scheider, Craig Kingsbury, Richard Dreyfuss, Robert Nevin, Belle McDonald, Carl Gottlieb, Susan Backlinie, Ted Grossman, Lee Fierro, Robert Shaw, Ayn Ruymen, Phil Murray, Joseph Oliveira, David Engelbach, Christopher Sands, Dorothy Fielding, Chris Rebello, Beverly Powers, Peter Benchley, Jonathan Filley, Joe La Creta, Lorraine Gary, Jeffrey Kramer, Murray Hamilton",/lxM6kqilAdpdhqUl2biYp5frUxE.jpg,B2
265,265,801,Planet of the Apes,871,7.65,1968-02-07,112,"Astronaut Taylor crash lands on a distant planet ruled by apes who use a primitive race of humans for experimentation and sport. Soon Taylor finds himself among the hunted, his life in the hands of a benevolent chimpanzee scientist.","Science Fiction, Adventure, Drama, Action",APJAC Productions,United States of America,Franklin J. Schaffner,"Frank Delfino, Linda Harrison, Dianne Stanley, Martin Abrahams, David Chow, George Sasaki, Felix Silla, Harry Monty, Lou Wagner, Army Archerd, Irvin 'Zabo' Koszewski, William Graeff Jr., Kim Hunter, Eldon Burke, Dave Rodgers, Chuck Fisher, Joe Tornatore, James Daly, Priscilla Boyd, James Whitmore, Charlton Heston, Woodrow Parfrey, Stephan Merjanian, Erlynn Mary Botelho, Jeff Burton, Cass Martin, Buddy Douglas, Jane Ross, Norma Jean Kron, Smokey Roberds, Buck Kartalian, Lars Hensen, John Quijada, Emory Souza, Robert Gunner, Paul Lambert, James Bacon, Billy Curtis, Roddy McDowall, Norman Burton, Robert Lombardo, Wright King, Maurice Evans, Jerry Maren",/2r9iKnlSYEk4daQadsXfcjHfIjQ.jpg,C1
639,639,2002,12 Angry Men,12219,7.645,1997-08-17,117,"During the trial of a man accused of his father's murder, a lone juror takes a stand against the guilty verdict handed down by the others as a result of their preconceptions and prejudices.","Drama, TV Movie",MGM Television,United States of America,William Friedkin,"Jack Lemmon, Hume Cronyn, Douglas Spain, Ossie Davis, Armin Mueller-Stahl, James Gandolfini, Tony Danza, Tyrees Allen, Mykelti Williamson, Dorian Harewood, Courtney B. Vance, Edward James Olmos, William Petersen, Mary McDonnell, George C. Scott",/whDdYx3lh1LHTN0VlPFt51fX29g.jpg,B2
924,924,3186,The Graduate,37247,7.64,1967-12-21,106,"Benjamin, a recent college graduate very worried about his future, finds himself in a love triangle with an older woman and her daughter.","Drama, Romance, Comedy",AVCO Embassy Pictures,United States of America,Mike Nichols,"George Bruggeman, Harry Holcombe, Robert Perry, Laurence Haddon, Kevin Tighe, Brian Avery, Buddy Douglas, Elisabeth Fraser, Arthur Tovey, Donald F. Glut, Noam Pitlik, Jonathan Hole, Alice Ghostley, Eleanore Vogel, Eve McVeagh, Anthony Redondo, Hal Taggart, Elaine May, Jay Dee Witney, William Daniels, David Westberg, Tim Taylor, Elizabeth Wilson, Maris Wrixon, Lainie Miller, Clark Ross, Bernard Sell, Murray Hamilton, Marion Lorne, Sam O'Steen, Wally West, Stuart Nisbet, Buck Henry, Frank Baker, Bob Folkerson, Katharine Ross, Mike Farrell, Wayne Stam, Norman Fell, Robert P. Lieb, Anne Bancroft, Ben Murphy, Dustin Hoffman, Bob Eubanks, Walter Brooke, Garrett Cassell, William H. O'Brien, Richard Dreyfuss, Eddra Gale",/qtVvdSsm2hvau6ItLe4gWdFKe2M.jpg,B1
587,587,1796,Kubo and the Two Strings,313297,7.631,2016-08-18,102,"Kubo mesmerizes the people in his village with his magical gift for spinning wild tales with origami. When he accidentally summons an evil spirit seeking vengeance, Kubo is forced to go on a quest to solve the mystery of his fallen samurai father and his mystical weaponry, as well as discover his own magical powers.","Animation, Adventure, Family",Laika,United States of America,Travis Knight,"Ralph Fiennes, Michael Sun Lee, Minae Noji, Laura Miro, Meyrick Murphy, Luke Donaldson, Zachary Alexander Rice, Thomas Isao Morinaka, Ken Takemoto, Aaron Aoki, Saemi Nakamura, Alpha Takahashi, Rachel Morihiro, Art Parkinson, Matthew McConaughey, Rooney Mara, Mariel Sheets, Cary Y. Mizobe, George Takei, Charlize Theron, Brenda Vaccaro, Cary-Hiroyuki Tagawa",/la6QA9tk4Foq8OBH2Dyh5dTcw6H.jpg,A2
11,11,31,Deadpool,293660,7.623,2016-02-09,108,"The origin story of former Special Forces operative turned mercenary Wade Wilson, who, after being subjected to a rogue experiment that leaves him with accelerated healing powers, adopts the alter ego Deadpool. Armed with his new abilities and a dark, twisted sense of humor, Deadpool hunts down the man who nearly destroyed his life.","Action, Adventure, Comedy",20th Century Fox,United States of America,Tim Miller,"Ed Skrein, Morena Baccarin, Cindy Piper, Victoria De Mare, Matthew Hoglie, Naika Toussaint, Ryan Reynolds, Fabiola Colmenero, Justyn Shippelt, Heather Ashley Chase, Hugh Scott, Paul Belsito, Style Dayne, Stan Lee, Kyle Cassie, Em Haine, Andre Tricoteux, Jed Rees, Gina Carano, Leslie Uggams, Randal Reeder, Paul Lazenby, Rob Hayter, Olesia Shewchuk, Stefan Kapičić, Rachel Sheen, Taylor Hickson, Chad Riley, Kyle Rideout, Jason William Day, T.J. Miller, Brianna Hildebrand, Ayzee, Aatash Amir, Michael Benyaer, Karan Soni, Donna Yamamoto, Benjamin Wilkinson, Isaac C. Singleton Jr., Darcey Johnson, Kayla Adams",/3E53WEZJqP6aM84D8CckXx4pIHw.jpg,B1
73,73,212,Guardians of the Galaxy Vol. 2,283995,7.619,2017-04-19,137,The Guardians must fight to keep their newfound family together as they unravel the mysteries of Peter Quill's true parentage.,"Science Fiction, Adventure, Action",Marvel Studios,United States of America,James Gunn,"Kurt Russell, Sierra Love, Jason Williams, Zoe Saldaña, Wyatt Oleff, Sylvester Stallone, Ben Browder, Stephen Blackehart, Dave Bautista, Richard Christy, Elizabeth Faith Ludlow, Milynn Sarley, Leota Gunn, Terence Rosemore, Blondy Baruti, Ving Rhames, Tommy Flanagan, Stan Lee, Luke Cook, Bradley Cooper, Joe Fria, Chris Pratt, Kelly Richardson, Vin Diesel, Guillermo Rodriguez, Jeff Goldblum, Michelle Yeoh, Josh Tipis, Molly C. Quinn, Rob Zombie, Aaron Schwartz, David Hasselhoff, Mac Wells, Gregg Henry, Damita Jane Howard, Fred Galle, Evan Jones, Mike Escamilla, Nea Dune, Kent Wagner, Seth Green, Donny Carrington, Joe Heath, Laura Haddock, Alphonso A'Qen-Aten Jackson, Hannah Gottesman, Jimmy Urine, Hilty Bowen, Karen Gillan, Kendra Carelli, Alex Klein, Steve Agee, Jim Gunn Sr., Chris Sullivan, Rhoda Griffis, Michael Rooker, Pom Klementieff, Michael Rosenbaum, Sean Gunn, Miley Cyrus, Elizabeth Debicki",/y4MBh0EjBlMuOzv9axM4qJlmhzz.jpg,C1
158,158,430,Anastasia,9444,7.616,1997-11-20,94,"Ten years after she was separated from her family, an eighteen-year-old orphan with vague memories of the past sets out to Paris in hopes of reuniting with her grandmother. She is accompanied by two con men, who intend to pass her off as the Grand Duchess Anastasia to the Dowager Empress for a reward.","Animation, Family, Fantasy, Adventure",Fox Animation Studios,United States of America,"Gary Goldman, Don Bluth","Jonathan Dokuchitz, Jeff Blumenkrantz, Lacey Chabert, Angela Lansbury, Kelsey Grammer, Kirsten Dunst, Andrea Martin, Hank Azaria, J.K. Simmons, John Cusack, Debra Mooney, Rick Jones, Liz Callaway, Jim Cummings, Charity James, Glenn Walker Harris Jr., Christopher Lloyd, Arthur Malet, Bernadette Peters, Meg Ryan, Billy Porter",/8LDVAMImGuMrNvyUWctvF4qkHwQ.jpg,B1
274,274,831,Groundhog Day,137,7.608,1993-02-11,101,"A narcissistic TV weatherman, along with his attractive-but-distant producer, and his mawkish cameraman, is sent to report on Groundhog Day in the small town of Punxsutawney, where he finds himself repeating the same day over and over.","Romance, Fantasy, Drama, Comedy",Columbia Pictures,United States of America,Harold Ramis,"Amy Murdoch, Andie MacDowell, Michael Shannon, Brian Doyle-Murray, Timothy Hendrickson, Roger Adler, Brian Willig, Ann Heekin, Tony DeGuide, Barbara Ann Grimes, Ben A. Fish, Lindsay Albert, Dianne B. Shaw, Chris Elliott, Don Riozz McNichols, Harold Ramis, Shaun Chaiyabhat, Angela Gollan, Willie Garson, Marita Geraghty, Lucina Paquet, Lee Sellars, Richard Henzel, Samuel Mages, Tom Milanovich, Robin Duke, Hynden Walch, Carol Bivins, Rod Sell, Eric Saiet, Rob Riley, Chet Dubowski, Martha Webster, Stephen Tobolowsky, Leighanne O'Neil, Ben Zwick, Peggy Roeder, Brenda Pickleman, Bill Murray, Ken Hudson Campbell, Reni Santoni, C.O. Erickson, Angela Paton, Rick Ducommun, Rick Overton, Sandy Maschmeyer, John M. Watson Sr., Evangeline Binkley, David Pasquesi, Les Podewell",/h1ZEBoi0waPwtAPU1cnSZifdqZh.jpg,B1
320,320,957,Twelve Monkeys,63,7.601,1995-12-29,129,"In the year 2035, convict James Cole reluctantly volunteers to be sent back in time to discover the origin of a deadly virus that wiped out nearly all of the earth's population and forced the survivors into underground communities. But when Cole is mistakenly sent to 1990 instead of 1996, he's arrested and locked up in a mental hospital. There he meets psychiatrist Dr. Kathryn Railly, and patient Jeffrey Goines, the son of a famous virus expert, who may hold the key to the mysterious rogue group, the Army of the 12 Monkeys, thought to be responsible for unleashing the killer disease.","Science Fiction, Thriller, Mystery",Universal Pictures,United States of America,Terry Gilliam,"Chuck Jeffreys, Joseph Melito, Frederick Strother, Charley Scalies, Harry O'Toole, Wilfred Williams, Donald Faison, Brad Pitt, Bruce Willis, H. Michael Walls, Stan Kang, Anthony 'Chip' Brienza, Michael Ryan Segal, Bonnie Loev, Paul Meshejian, Lisa Talerico, John Blaisse, Michael Chance, Jann Ellis, Bart the Bear, Bob Adrian, Nell Johnson, LisaGay Hamilton, Bill Raymond, Simon Jones, Felix Pire, Robert O'Neill, Allelon Ruggiero, Tom Detrik, Joey Perillo, John Panzarella, Madeleine Stowe, Vernon Campbell, Joilet Harris, Drucie McDaniel, Janet Zappala, Christopher Plummer, Joe Gerety, Ernest Abuba, Karl Warren, Louis Lippa, Stephen Bridgewater, Joseph McKenna, Annie Golden, Barry Price, Jon Seda, Pat Dias, Bruce Kirkpatrick, Tiffany Baldwin, C.J. Byrnes, Sal Mazzotta, Matt Ross, Charles Techman, Rick Warner, Raymond Mamrak, Rozwill Young, Christopher Meloni, David Morse, Frank Gorshin, Irma St. Paule, Kevin Thigpen, Ray Huffman, Thang, Richard Stanley, Carol Florence, Korchenko, Aaron Michael Lacey",/gt3iyguaCIw8DpQZI1LIN5TohM2.jpg,C1
29,29,77,Thor: Ragnarok,284053,7.6,2017-10-02,131,"Thor is imprisoned on the other side of the universe and finds himself in a race against time to get back to Asgard to stop Ragnarok, the destruction of his home-world and the end of Asgardian civilization, at the hands of a powerful new threat, the ruthless Hela.","Action, Adventure, Science Fiction",Marvel Studios,United States of America,Taika Waititi,"Garreth Hadfield, Idris Elba, Sophia Laryea, Benedict Cumberbatch, Zachary Levi, Katie Anderson, Richard Green, Rob Mayes, Hamish Parkinson, Chris Hemsworth, Charlotte Nicdao, Jeff Goldblum, Sean Edward Frazer, Greta Carew-Johns, Tracie Filmer, Anthony Hopkins, Shari Sebbens, Jet Tranter, Stan Lee, Sam Hargrave, Cate Blanchett, Luke Hemsworth, Tom Hiddleston, Clancy Brown, Karl Urban, Connor Zegenhagen, Ray Stevenson, Cohen Holloway, Jasper Bagg, Eloise Winestock, Sam Neill, Tadanobu Asano, Taylor Hemsworth, Georgia Blizzard, Alia Seror-O'Neill, Sophia McGregor, Amali Golden, Tracey Lee Maxwell, Sky Castanho, Rachel House, Tahlia Jade, Sol Castanho, Steven Oliver, Donnie Baxter, Shalom Brune-Franklin, Matt Damon, Taika Waititi, Braden Lewis, Winnie Mzembe, Mollie McGregor, Tessa Thompson, Ash Ricardo, Samantha Hopper, Beatrice Ward, Mark Ruffalo",/rzRwTcFvttcN1ZpX2xv4j3tSdJu.jpg,C1
