,Unnamed: 0.1,Unnamed: 0,title,tmdbid,rank,release_date,runtime,summary,genres,production,country,director,starring,poster_path,study_level
38,38,95,Harry Potter and the Goblet of Fire,674,7.8,2005-11-16,157,"When Harry Potter's name emerges from the Goblet of Fire, he becomes a competitor in a grueling battle for glory among three wizarding schools—the Triwizard Tournament. But since Harry never submitted his name for the Tournament, who did? Now Harry must confront a deadly dragon, fierce water demons and an enchanted maze only to find himself in the cruel grasp of He Who Must Not Be Named.","Adventure, Fantasy",Warner Bros. Pictures,United Kingdom,Mike Newell,"Christopher Whittingham, Robert Wilfort, Alan Rickman, Gary Oldman, David Bradley, Robbie Coltrane, Flip Webster, William Melling, Campbell Graham, Matthew Lewis, Shefali Chowdhury, Jason Isaacs, Alex Palmer, Henry Lloyd-Hughes, Alan Watts, Devon Murray, James Phelps, Angelica Mandy, Josh Herdman, Robert Hardy, David Tennant, Adrian Rawlins, Louis Doyle, Richard Rosson, Olivia Higginbottom, Ralph Fiennes, Ashley Artus, Margery Mason, Bonnie Wright, Steve Mackey, Steven Claydon, Emma Watson, Tolga Safer, Robert Pattinson, Frances de la Tour, Timothy Spall, Sheila Allen, Oliver Phelps, Michael Gambon, David Sterne, Alfred Enoch, Rupert Grint, Philip Rham, Jonny Greenwood, Tiana Benjamin, Shirley Henderson, Warwick Davis, Paschal Friel, Clémence Poésy, Jarvis Cocker, Tom Felton, Stanislav Yanevski, Jason Buckle, Eric Sykes, Miranda Richardson, Afshan Azad, Anne Lacy, Su Elliot, Predrag Bjelac, Liam McKenna, Brendan Gleeson, Philip Selway, Katie Leung, Jeff Rawle, Daniel Radcliffe, Mark Williams, Geraldine Somerville, Roger Lloyd Pack, Charlotte Skeoch, Maggie Smith, Jamie Waylett",/fECBtHlr0RB3foNHDiCBXeg9Bv9.jpg,B2
118,118,335,Toy Story 3,10193,7.8,2010-06-16,103,"Woody, Buzz, and the rest of Andy's toys haven't been played with in years. With Andy about to go to college, the gang find themselves accidentally left at a nefarious day care center. The toys must band together to escape and return home to Andy.","Animation, Family, Comedy",Pixar,United States of America,Lee Unkrich,"Jan Rabson, Bud Luckey, Wallace Shawn, Teddy Newton, Godfrey Gao, Blake Clark, Teresa Ganzel, Nikolas Michailidis, Richard Kind, Jeff Pidgeon, Jodi Benson, Carlos Alazraqui, Amber Kroner, Danny Mann, Tom Hanks, R. Lee Ermey, Woody Smith, John Ratzenberger, Laurie Metcalf, Tim Allen, Adam Joshua Jastrow, Jeff Garlin, Bonnie Hunt, Leo Jergovic, Hannah Unkrich, Theodore F. Kayser, Jim Ward, Lori Alan, Emily Hahn, Brianna Maiwand, Jess Harnell, Bob Peterson, Bea Miller, Laraine Newman, John Morris, Jerome Ranft, Whoopi Goldberg, Colleen O'Shaughnessey, Erik von Detten, Jack Angel, Mickie McGowan, Ned Beatty, Estelle Harris, Gia Michailidis, Colette Whitaker, John Cygan, Sherry Lynn, Kristen Schaal, Don Rickles, Aramé Scott, Timothy Dalton, Lee Unkrich, Joan Cusack, Charlie Bright, Constantino Bravos, Michael Keaton, Taiana Huff, Javier Fernández-Peña, Frank Welker, Jack Willis",/AbbXspMOwdvwWZgVN0nabZq03Ec.jpg,A2
185,185,527,Knives Out,546554,7.8,2019-11-27,131,"When renowned crime novelist Harlan Thrombey is found dead at his estate just after his 85th birthday, the inquisitive and debonair Detective Benoit Blanc is mysteriously enlisted to investigate. From Harlan's dysfunctional family to his devoted staff, Blanc sifts through a web of red herrings and self-serving lies to uncover the truth behind Harlan's untimely death.","Comedy, Crime, Mystery",Lionsgate,United States of America,Rian Johnson,"Frankie Francois, Edi Patterson, Michael Shannon, LaKeith Stanfield, Chris Evans, Marlene Forte, Marcela Jaramillo, Ben Bunnag, Paul Tawczynski, Don Johnson, Michael Burnell, Rob Lévesque, M. Emmet Walsh, Joseph Gordon-Levitt, Jamie Lee Curtis, Gabrielle Lorthe, Christopher Plummer, Daniel Craig, Shyrley Rodriguez, Frank Oz, Paul Bellefeuille, Jaeden Martell, Gary Tanguay, Toni Collette, Riki Lindhome, Octavia Chavez-Richmond, Kerry Frances, Katherine Langford, Ana de Armas, Noah Segan, Raúl Castillo, K Callan",/pThyQovXQrw2m0s9x82twj48Jq4.jpg,B2
231,231,687,Straight Outta Compton,277216,7.8,2015-08-11,147,"In 1987, five young men, using brutally honest rhymes and hardcore beats, put their frustration and anger about life in the most dangerous place in America into the most powerful weapon they had: their music.  Taking us back to where it all began, Straight Outta Compton tells the true story of how these cultural rebels—armed only with their lyrics, swagger, bravado and raw talent—stood up to the authorities that meant to keep them down and formed the world’s most dangerous group, N.W.A.  And as they spoke the truth that no one had before and exposed life in the hood, their voice ignited a social revolution that is still reverberating today.","Drama, Music, History",Broken Chair Flickz,United Kingdom,F. Gary Gray,"Jason Johnson, Toryan Rogers, David S. Robinson Hicks, Cassandra Bautista, Carra Patterson, Rick Silver, Asia'h Epperson, O'Shea Jackson Jr., Shanae Cole, David Cohen, Franklin J. Sterns, Bruce Beatty, Tsion Mitchell, Vi Faulkner, Andrew Borba, William LaDawn English, Jessica Juarez, Allen Maldonado, Jody Burks, Aeriél Miranda, Vince Romo, Angela Elayne Gibbs, Aldis Hodge, Todd Quillen, Jahmilla Jackson, Caileigh Scott, Aswad Ali, Travis Nicholson, Carmina Scarpa, Phillip Ristaino, Joshua Geter, Precious Jenkins, India Howard, Val Emanuel, Matthew Downs, Jamaal Lewis, Tyron Woodley, Alex Roth, Neil Brown Jr., Michael W. Broomer, Dan Wells, Sierra Meshele Williams, Lesean Tarkington, Diezel Ramos, Julius Denem, Benjamin Levy Aguilar, Jana Ritter, Anna Clols, Lawrence Moran, Tate Ellington, Yatoya Toy, Marcc Rose, Joy Benedict, Spencer Melville, Kelsey Delemar, Tiffany Kimbrough, Diana Atai, Shaniece Cole, Cleavon McClendon, J. Kristopher, Ron Lunceford, Ashanna Bri, Corey Hawkins, Derrick L. McMillon, Phedra Syndelle, Nigel Lawes, ''Knife'' Sotelo, Jamal Quezaire, Lazarus Guidry, Ina-Alice Kopp, David Greyson, Newton Mayenge, Sky Soleil, Greg Collins, Demetrius Grosse, Suzanne Sumner Ferry, Paul Giamatti, Rey Castro, Tekin Girgin, Keith Powers, Kadrolsha Ona Carole, Marcus Callender, Jimmy Star, Melissa Bidgoli, Samantha Kelly, Maria Sten, Jason Mitchell, F. Gary Gray, Tonya T. Cannon, Fernando Edwards, Scott Endicott, Toni Duclottni, Michael L. Howard, LaFrazia D. Knighten, Deborah Lacey, Justin Goslee, Thomas R. Baker, Brian Metran, Joe P. Harris, Benicio Hall, Mercedes Young, A. Russell Andrews, Ariel Rogers, Matthew Boylan, Vaughn Wilkinson, Charity Caldwell, Rob Nagle, LaKeith Stanfield, Christian Brown, Greg Duncan, Leo Stallworth, Callen David, Steve Troublesome Castillo, David Pearl, Americo Galli, David Anthony Buglione, Steve Turner, Arturo Encinas, Tim Connolly, Ciera Foster, Xu Razer, Dean Cameron, Krystal M. Harris, Solange Hordatt, Matt Corboy, Zee James, Slim Khezri, R. Marcos Taylor, Keion Adams, Chauntae Pink, Michael 'Compton Menace' Taylor, Philly Swain, Dakota Black, Lauren Daisy White, Corey Reynolds, David Donah, Steve Kaufmann, Sheldon A. Smith, Ashton Sanders, Chic Daniel, David L. Cox, Dwayne Marion Johnson, Elena Goode, Kimberly Ryans, Prince Shah, Philicia Saunders, Bryan Casserly, Joshua Brockington, Rogelio Douglas Jr., Menah Carter, Michael Eauslin, Jaron Marquis, David Dustin Kenyon, Oscar Pereida, Sean Quezada, Water L, Brian Gilleece, Ray Leonard, Jr., Ladell Preston, Leonel Claude, Natascha Hopkins, Alex Wexo, Marlon Yates Jr., Brian Bell, Cris D'Annunzio, Khalid Ghajji, Phillip O’Riley, Kofi Siriboe, John Prosky, Rob Brownstein, Ashley Stepteau, Simon Rhee, David Ulmer, Mark Sherman, Thomas Q. Jones, Scott Engrotti, Orlando Brown, Alexandra Shipp, Lex Montgomery, Larry Sullivan, Ebony Randall, Mark Thomas Holguin, Phillipos Haile, Bogdan Szumilas, Blu Lindsey, Leland White, Wilfred Lopez, Mota Maria, Lisa Renee Pitts, Dave Bean, Inny Clemons",/9B63hMwU6iICtNDTISCaZQ5US7R.jpg,C1
240,240,718,Donnie Darko,141,7.8,2001-01-19,114,"After narrowly escaping a bizarre accident, a troubled teenager is plagued by visions of a large bunny rabbit that manipulates him to commit a series of crimes.","Fantasy, Drama, Mystery",Flower Films,United States of America,Richard Kelly,"Tom Tangen, Sarah Hudson, Arthur Taxier, Rachel Winfree, Jazzie Mahannah, Scotty Leavenworth, Patrick Swayze, Marina Malota, Lisa K. Wyatt, Jack Salvatore, Jr., Patience Cleveland, Phyllis Lyons, Mark Hoffman, Kristina Malota, Alex Greenwald, Alison Jones, Jerry Trainor, Maggie Gyllenhaal, Fran Kranz, Joan Blair, Tiler Peck, James Duval, Holmes Osborne, Beth Grant, Mary McDonnell, Stuart Stone, Gary Lundy, Katharine Ross, Ashley Tisdale, Seth Rogen, Jake Gyllenhaal, David St. James, Daveigh Chase, Jena Malone, David Moreland, Carly Naples, Drew Barrymore, Noah Wyle, Lee Weaver, Jolene Purdy",/fhQoQfejY1hUcwyuLgpBrYs6uFt.jpg,B2
247,247,747,Warrior,59440,7.8,2011-09-09,140,"The youngest son of an alcoholic former boxer returns home, where he's trained by his father for competition in a mixed martial arts tournament – a path that puts the fighter on a collision course with his estranged, older brother.","Drama, Action",Lionsgate,United States of America,Gavin O'Connor,"Roan Carneiro, Jimmy Cvetic, Raymond Rowe, Sandy Notaro, Fernando Chien, Andre' Mason, Etta Cox, Anthony Tambakis, Frank Grillo, Yves Edwards, Francesca Ortenzio, Laura Chinn, Adam Christian Stanley, Anthony Johnson, Kevin P. Hanley, James Houk, Nick Nolte, Joel Edgerton, Jennifer Morrison, Maximiliano Hernández, Nate Marquardt, Tammy Townsend, Lambert R. Strayer, Tom Hardy, Amir Perets, Stephan Bonnar, Michelle Dawn Mooney, Roman Vasylyshyn, Noah Emmerich, Jonathan Matthew Anik, Vanessa Martinez, Timothy ""Skyskrape"" Katz, Julia Stockstad, James Dreussi, Kurt Angle, Josh Rosenthal, Daniel Stevens, Jake Digman, Hans Marrero, Aaron Kleiber, Rashad Evans, Capri Thomas, Erik Apple, Richard Fike, Tim Bickel, Jeff Hochendoner, Kevin Dunn, Gavin O'Connor, Bryan Callen, Nick Lehane, Dan Caldwell, Jack Fisher, Thomas McCue, Anthony N., Denzel Whitaker, Sam Sheridan, Armon York Williams, Jaime Sinue Aguirre, Tracy Campbell, Jace Jeanes, Lexi Cowan, Jake McLaughlin, Carlos Miranda",/iM8n4nZJPR2abpnyZ36FUgHiRjr.jpg,B2
278,278,838,Snatch,107,7.8,2000-09-01,103,"Unscrupulous boxing promoters, violent bookmakers, a Russian gangster, incompetent amateur robbers and supposedly Jewish jewelers fight to track down a priceless stolen diamond.","Crime, Comedy",SKA Films,United Kingdom,Guy Ritchie,"Austin Drage, Velibor Topic, Jason Ninh Cao, Christopher Fosh, Brad Pitt, Tim Faraday, Elwin 'Chopper' David, Vinnie Jones, Shaun Pearson, Jimmy Roussounis, Sidney Sedin, Joe Williams, Charles Cork, John Farnell, Guy Ritchie, Teena Collins, Alex Andreas, Sol Campbell, Lennie James, Adam Fogerty, Andrew Shield, Alan Ford, Stephen Graham, William Beck, Liam Donaghy, Tom Delmar, John Hathaway, Mike Reid, Jason Statham, Andy Beckwith, Ronald Isaac, Sorcha Cusack, Robbie Gee, Peter Szakacs, Dian Bachar, Trevor Steedman, Dean Smith, Mickey Dee, Goldie, Yuri Stepanov, John Taheny, Tim Packham, Dennis Farina, Chuck Julian, James Warren, Rade Šerbedžija, Benicio del Toro, Peter Rnic, Eric Meyers, Nicola Collins, Andy Till, Sid Hoare, Ade, Sam Douglas, Scott Welch, Ewen Bremner, Jason Flemyng, Jason Buckham, Roy Snell, James Cunningham, Paul O'Boyle, Mick Theo, Michael Hughes, Liam McMahon, Dave Legeno, Mickey Cantwell",/8KSDI7ijEv7QVZdIyrLw5Gnhhr8.jpg,B1
284,284,856,Rocky,1366,7.8,1976-11-20,120,An uneducated collector for a Philadelphia loan shark is given a once-in-a-lifetime opportunity to fight against the world heavyweight boxing champion.,Drama,Winkler Films,United States of America,John G. Avildsen,"Frank Pesce, Joe Spinell, Joe Frazier, Michael Dorn, Billy Sands, Peter Glassberg, Jack Hollander, Talia Shire, Pedro Lovell, Thayer David, Larry Carroll, Diana Lewis, Burgess Meredith, Christopher Avildsen, Joe Sorbello, Burt Young, Don Sherman, DeForest Covan, Jodi Letizia, Lavelle Roby, Arthur Tovey, Stu Nahan, Jimmy Gambina, George O'Hanlon, George Memmoli, Paris Eagle, Jane Marla Robbins, Carl Weathers, Frankie Van, Joseph C. Giambelluc, Arnold Johnson, Robert L. Tangrea, Tony Burton, Kathleen Parker, Frank Stallone Sr., Stan Shaw, Al Silvani, William E. Ring, Lou Fillipo, Sylvester Stallone, Hank Rolike, John Pleshette, Shirley O'Hara, Frank Stallone Jr., Simmy Bow, Butkus Stallone, Bill Baldwin, Lloyd Kaufman",/aYtBYWqCdUqcnoodWJdcTG3pFev.jpg,C1
364,364,1088,The Big Lebowski,115,7.8,1998-03-06,117,"Jeffrey 'The Dude' Lebowski, a Los Angeles slacker who only wants to bowl and drink White Russians, is mistaken for another Jeffrey Lebowski, a wheelchair-bound millionaire, and finds himself dragged into a strange series of events involving nihilists, adult film producers, ferrets, errant toes, and large sums of money.","Comedy, Crime",PolyGram Filmed Entertainment,United Kingdom,Joel Coen,"Jimmie Dale Gilmore, Leon Russom, Julianne Moore, Sam Elliott, Marshall Manesh, Philip Seymour Hoffman, Mark Pellegrino, Aimee Mann, James G. Hoosier, Torsten Voges, John Goodman, Kiva Dawson, Jesse Flanagan, Peter Stormare, John Turturro, Steve Buscemi, Jack Kehler, Philip Moon, David Huddleston, Flea, Carlos Leon, Harry Bugin, Richard Gant, Jennifer Lamb, Gérard L'Heureux, Warren Keith, David Thewlis, Asia Carrera, Terrence Burton, Christian Clemenson, Peter Siragusa, Jerry Haleva, Jeff Bridges, Luis Colina, Tara Reid, Irene Olga López, Ajgie Kirkland, Ben Gazzara, Jon Polito, Lu Elrod, Dom Irrera, Wendy Braun, Mike Gomez",/9mprbw31MGdd66LR0AQKoDMoFRv.jpg,B1
398,398,1195,Back to the Future Part II,165,7.8,1989-11-22,108,"Marty and Doc are at it again in this wacky sequel to the 1985 blockbuster as the time-traveling duo head to 2015 to nip some McFly family woes in the bud. But things go awry thanks to bully Biff Tannen and a pesky sports almanac. In a last-ditch attempt to set things straight, Marty finds himself bound for 1955 and face to face with his teenage parents -- again.","Adventure, Comedy, Science Fiction",Universal Pictures,United States of America,Robert Zemeckis,"Jennifer Brown, Michael J. Fox, Elisabeth Shue, Flea, Billy Zane, Elijah Wood, Wesley Mann, Lindsey Whitney Barry, George Buck Flower, Shaun Hunter, John Erwin, Jason Scott Lee, Irina Cashen, Thomas F. Wilson, Marty Levy, Tommy Thomas, J.J. Cohen, Jeffrey Weissman, Christopher Lloyd, James Tolkan, Judy Ovitz, Al White, Charles Gherardi, Jim Ishida, Charles Fleischer, Tamara Carrera, Tracy Dali, Casey Siemaszko, Darlene Vogel, Theo Schwartz, Nikki Birdsong, Justin Mosley Spink, Lisa Freeman, Granville 'Danny' Young, Harry Waters, Jr., Angela Greenblatt, Neil Ross, Junior Fann, David Harold Brown, Joe Flaherty, Marc McClure, Lloyd L. Tolbert, Ricky Dean Logan, Lea Thompson, Jay Koch, Cameron Moore, Mary Ellen Trainor, E. Casanova Evans, Stephanie Williams, John Thornton",/hQq8xZe5uLjFzSBt4LanNP7SQjl.jpg,B2
448,448,1341,Die Hard,562,7.8,1988-07-15,132,"NYPD cop John McClane's plan to reconcile with his estranged wife is thrown for a serious loop when, minutes after he arrives at her office, the entire building is overtaken by a group of terrorists. With little help from the LAPD, wisecracking McClane sets out to single-handedly rescue the hostages and bring the bad guys down.","Action, Thriller",Gordon Company,United States of America,John McTiernan,"Jon E. Greene, Paul Gleason, Anthony Peck, Kip Waldo, Terry Ray, Mark Goldstein, Alan Rickman, De'voreaux White, Scot Bennett, Mary Ellen Trainor, Charlie Picerni, Fred Lerner, Al Leong, Kate Finlayson, Taylor Fry, Bob Jennings, Reginald VelJohnson, Clarence Gilyard Jr., George Christy, Bruce Willis, Tracy Reiner, Grand L. Bush, Conrad Hurtt, Rick Cicetti, Terri Lynn Doss, Shanna Higgins, Dennis Hayden, Dustyn Taylor, Kym Malin, Selma Archerd, Richard Parker, Harri James, William Atherton, Stella Hall, Hart Bochner, Robert Lesser, Andreas Wisniewski, Cheryl Baker, Hans Buhringer, Noah Land, Betty Carvalho, Wilhelm von Homburg, David Ursin, Eric Kay, Bill Margolin, Lorenzo Caccialanza, Michele Laybourn, Bruce P. Schultz, Robert Davi, James Shigeta, Gerard Bonn, Gary Roberts, Carmine Zozzora, P. Randall Bowers, Bill Marcus, Shelley Pogoda, Rebecca Broussard, Rick Ducommun, David Katz, Bonnie Bedelia, Joey Plewa, Bruno Doyon, Matt Landers, Alexander Godunov",/7Bjd8kfmDSOzpmhySpEhkUyK2oH.jpg,B2
458,458,1397,Fantastic Mr. Fox,10315,7.8,2009-10-23,87,"The Fantastic Mr. Fox, bored with his current life, plans a heist against the three local farmers. The farmers, tired of sharing their chickens with the sly fox, seek revenge against him and his family.","Adventure, Animation, Comedy, Family",Regency Enterprises,United States of America,Wes Anderson,"Jeremy Dawson, Helen McCrory, George Clooney, James Hamilton, Jennifer Furches, Owen Wilson, Jarvis Cocker, Martin Ballard, Jason Schwartzman, Roman Coppola, Meryl Streep, Bill Murray, Michael Gambon, Juman Malouf, Allison Abbate, Hugo Guinness, Wallace Wolodarsky, Rob Hersov, Karen Duffy, Willem Dafoe, Mario Batali, Garth Jennings, Adrien Brody, Molly Cooper, Wes Anderson, Brian Cox, Tristan Oliver, Steven M. Rales, Eric Chase Anderson, Robin Hurlstone",/t5v2Zsb5sa6PSP9jMUWY4GdIb3c.jpg,A2
483,483,1488,Into the Wild,5915,7.8,2007-09-21,148,"After graduating from Emory University in 1992, top student and athlete Christopher McCandless abandons his possessions, gives his entire $24,000 savings account to charity, and hitchhikes to Alaska to live in the wilderness.","Adventure, Drama",River Road Entertainment,United States of America,Sean Penn,"Jim Gallien, Signe Egholm Olsen, Floyd Wall, Haley Ramm, Jena Malone, Cheryl Francis Harrington, Jim Davis, Carine McCandless, Catherine Keener, Malinda McCollum, Terry Waldner, Robin Mathews, Hal Holbrook, John Hofer, William Hurt, Everett 'Insane Wayne' Smith, James J. O'Neill, Brian H. Dierker, John Decker, Denise Sitton, Merritt Wever, Candice Campos, Sharon Olds, Bryce Walters, Jim Beidler, Haley Sweet, Craig Mutsch, Jerry Hofer, John Jabaley, Matt Contreras, Aaron Wayne Hill, Emile Hirsch, Parris Mosteller, Marcia Gay Harden, Bart the Bear II, Timothy Levine, Zach Galifianakis, Paul Knauls, J. Nathan Simmons, Vince Vaughn, Kristen Stewart, Leonard Knight, Steven Wiig, Thure Lindhardt, R. D. Call",/2MSGZEE6XZd2r4ODNziwAw7Hpw0.jpg,C1
486,486,1496,Dances with Wolves,581,7.8,1990-03-30,181,"Wounded Civil War soldier John Dunbar tries to commit suicide—and becomes a hero instead. As a reward, he's assigned to his dream post, a remote junction on the Western frontier, and soon makes unlikely friends with the local Sioux tribe.","Adventure, Drama, Western",Tig Productions,United Kingdom,Kevin Costner,"Doris Leader Charge, Graham Greene, Otakuye Conroy, Floyd 'Red Crow' Westerman, Carter Hanner, Wes Studi, Mary McDonnell, Kevin Costner, Tantoo Cardinal, William H. Burton Jr., Frank P. Costanza, Charles Rocket, Richard Leader Charge, Steven Chambers, Michael Spears, Kirk Baltz, Tom Everett, Bill W. Curry, R. L. Curtin, Michael Horton, Donald Hotton, Robert Goldman, John Tail, Kent Hays, James A. Mitchell, Marvin Holy, Elisa Daniel, Steve Reevis, Justin, Buck, Robert Pastorelli, Jimmy Herman, Clayton Big Eagle, Maretta Big Crow, Jason R. Lone Hill, Annie Costner, Buffalo Child, David J. Fuller, Conor Duffy, Wayne Grace, Rodney A. Grant, Tony Pierce, Redwing Ted Nez, Ryan White Bull, Maury Chaykin, Raymond Newholy, Nick Thompson, Sheldon Peters Wolfchild, Larry Joshua, Percy White Plume, Teddy, Nathan Lee Chasing His Horse",/cvaBVpS0GzKqBd63pFT8f1E8OKv.jpg,B2
543,543,1674,Network,10774,7.8,1976-11-14,122,"When veteran anchorman Howard Beale is forced to retire his 25-year post because of his age, he announces to viewers that he will kill himself during his farewell broadcast. Network executives rethink their decision when his fanatical tirade results in a spike in ratings.",Drama,Metro-Goldwyn-Mayer,United States of America,Sidney Lumet,"William Holden, Paul Jenkins, Sasha von Scherler, Mitchell Jason, Darryl Hickman, Lynn Klugman, Roy Poole, Robert Duvall, Kenneth Kimmins, Beatrice Straight, Fred Stuthman, Ken Kercheval, Faye Dunaway, Jerome Dempsey, John Carpenter, Cindy Grover, Lane Smith, Stanley Grover, Kathy Cronkite, Bernard Pollock, Wesley Addy, Russ Petranto, Marlene Warfield, Lance Henriksen, Michael Lipton, Carolyn Krigbaum, Gene Gross, Lydia Wilen, Ed Crowley, Ned Beatty, William Prince, Bill Burrows, Zane Lasky, Michael Lombard, Pirie MacDonald, Conchata Ferrell, Peter Finch, Lee Richardson, Arthur Burghardt, Jordan Charney, Ted Sorel, Cameron Thomas",/qZomlHsaALUtkFeMDwdYmwS2Pbo.jpg,C1
551,551,1698,The Perks of Being a Wallflower,84892,7.8,2012-09-20,103,"Pittsburgh, Pennsylvania, 1991. High school freshman Charlie is a wallflower, always watching life from the sidelines, until two senior students, Sam and her stepbrother Patrick, become his mentors, helping him discover the joys of friendship, music and love.",Drama,Mr. Mudd,United States of America,Stephen Chbosky,"Stacy Chbosky, Brian Balzerini, Laurie Klatscher, Julie Marie Schaefer, Isabel Muschweck, Landon Pigg, Johnny Simmons, Logan Lerman, Emily Marie Callaway, Melanie Lynskey, Ezra Miller, Dihlon McManne, Chelsea Zhang, Emma Watson, Joan Cusack, Nicholas Braun, Joe Fishel, Mark McClain Wilson, Jennifer Enskat, Jesse Scheirer, Zane Holtz, William L. Thomas, Mae Whitman, Atticus Cain, Leo Miles Farmerie, Kate Walsh, Paul Rudd, Reece Thompson, Tom Kruszewski, Jordan Paley, Julia Garner, Adam Hagenbuch, Nina Dobrev, Erin Wilhelmi, Dylan McDermott, Tom Savini, Justine Nicole Schaefer, Timothy Breslin, Patrick de Ledebur, Morgan Wolk",/aKCvdFFF5n80P2VdS7d8YBwbCjh.jpg,C1
573,573,1763,Awakenings,11005,7.8,1990-12-04,120,"Dr. Malcolm Sayer, a shy research physician, uses an experimental drug to ""awaken"" the catatonic victims of a rare disease. Leonard is the first patient to receive the controversial treatment. His awakening, filled with awe and enthusiasm, proves a rebirth for Sayer too, as the exuberant patient reveals life's simple but unutterably sweet pleasures to the introverted doctor.",Drama,Parkes/Lasker productions,United States of America,Penny Marshall,"Shane Fistell, Paul Montgomery, Barton Heyman, Waheedah Ahmad, Buck Smith, John Christopher Jones, Gwyllum Evans, Judith Malina, Charles Keating, Judy Jacksina, Michael Hyde, Mary Catherine Wright, Laura Esterman, Harry L. Seddon, Max von Sydow, Bradley Whitford, Linda Burns, Joan E. MacIntosh, Byron Utley, Steve Vinovich, Howard Feller, Vincent Pastore, Jayne Haynes, Peter Stormare, Robin Williams, George Martin, Rico Elias, Oliver Block, Chris Carolan, Libby Titus, Anne Meara, Alice Drummond, Le Clanché du Rand, Tiger Haynes, Gary Tacon, Mary Alice, Gloria Harper, Tanya Berezin, Harvey Miller, Debra Kovner-Zaks, Julie Kavner, Steven Randazzo, Anthony McGowen, Ruth Nelson, Jack Mulcahy, Penelope Ann Miller, Jason W. Fuchs, Keith Diamond, Christina Huertes, Adam Bryant, Anthony J. Nici, Richard Libertini, Tomislav Novakovic, Vin Diesel, Dexter Gordon, Max Rabinowitz, Yusef Bulos, John Heard, Robert De Niro, Gordon Joseph Weiss, Leonard Tepper, Mel Gorham",/9gztZXuHLG6AJ0fgqGd7Q43cWRI.jpg,C1
588,588,1797,Scent of a Woman,9475,7.8,1992-12-23,156,"Charlie Simms is a student at a private preparatory school who comes from a poor family. To earn the money for his flight home to Gresham, Oregon for Christmas, Charlie takes a job over Thanksgiving looking after retired U.S. Army officer Lieutenant Colonel Frank Slade, a cantankerous middle-aged man who lives with his niece and her family.","Drama, Comedy",Universal Pictures,United States of America,Martin Brest,"Lucy Smith, Nicholas Sadler, Jack Mulcahy, David Lansbury, Bradley Whitford, June Squibb, Philip Seymour Hoffman, Paul Stocker, Matt Smith, J.T. Cromwell, Russell Gibson, George Grafas, Alyson Feldman, Max Stein, Carlo Giuliano, Erika Feldman, Michael Simon, Leonard Gaines, Dan Gifford, Gabrielle Anwar, Al Pacino, Michael Santoro, Rochelle Oliver, Anh Duong, Tom Riis Farrell, Margaret Eginton, Joseph Palmas, Eric Reid Schroeder, Ron Eldard, Sally Murphy, Richard Venture, James Rebhorn, Chris O'Donnell, Todd Louiso, Peter Carew, Baxter Harris, Mike Lisenco, William Beckwith, Mansoor Najee-Ullah, Julian Stein, Stephen L'Heureux, Frances Conroy, Paul Zimmerman, Gene Canfield, Divina Cook, Francie Swift, Luke L. Hansen",/f75Fsfx8nA8JfSdJ61jhC8JwHps.jpg,B1
628,628,1958,Monty Python and the Holy Grail,762,7.8,1975-03-14,91,"King Arthur, accompanied by his squire, recruits his Knights of the Round Table, including Sir Bedevere the Wise, Sir Lancelot the Brave, Sir Robin the Not-Quite-So-Brave-As-Sir-Lancelot and Sir Galahad the Pure. On the way, Arthur battles the Black Knight who, despite having had all his limbs chopped off, insists he can still fight. They reach Camelot, but Arthur decides not  to enter, as ""it is a silly place"".","Adventure, Comedy, Fantasy",Python (Monty) Pictures Limited,United Kingdom,"Terry Gilliam, Terry Jones","Sally Kinghorn, Margarita Doyle, Maggie Weston, Sally Coombe, Connie Booth, Romilly Squire, Tom Raeburn, Bee Duffell, Graham Chapman, John Young, Mark Zycon, Charles Knode, Mary Allen, Sylvia Taylor, Scott Mike, Roy Forge Smith, Sandy Rose, Loraine Ward, William Palin, Brian Ross, Joyce Pollner, Terry Jones, Eric Idle, Joni Flynn, John Thornton, Neil Innes, Mitsuko Forstater, Sandy Johnson, Anna Lanski, Zack Matalon, Fiona Gordon, Iain Banks, Judy Lamb, Tracy Sneddon, Gloria Graham, Vivienne MacDonald, Michael Palin, Alison Walker, Carol Cleveland, Terry Gilliam, Rita Davies, Elspeth Cameron, Julian Doyle, John Cleese, Daphne Darling, Yvonne Dick, Avril Stewart",/xZ0rC0kuIsjk6RncpNK73kwstEP.jpg,B1
