,Unnamed: 0.1,Unnamed: 0,title,tmdbid,rank,release_date,runtime,summary,genres,production,country,director,starring,poster_path,study_level
8,8,23,The Godfather,238,8.7,1972-03-14,175,"Spanning the years 1945 to 1955, a chronicle of the fictional Italian-American Corleone crime family. When organized crime family patriarch, Vito Corleone barely survives an attempt on his life, his youngest son, Michael steps in to take care of the would-be killers, launching a campaign of bloody revenge.","Drama, Crime",Paramount Pictures,United States of America,Francis Ford Coppola,"Ron Gilbert, Rick Petrucelli, Filomena Spagnuolo, Raymond Martino, James Caan, Sterling Hayden, Richard Bright, Carol Morley, Alex Rocco, Vito Scotti, Rudy Bond, John Marley, Tere Livrano, Tony King, Frank Sivero, Lou Martini Jr., Gabriele Torrei, Nick Vallelonga, Talia Shire, Simonetta Stefanelli, Roman Coppola, Louis Guss, Al Pacino, Tony Lip, Conrad Yama, MAHAD, Italia Coppola, Al Lettieri, Sofia Coppola, Richard S. Castellano, Diane Keaton, Corrado Gaipa, Ardell Sheridan, John Martino, Saro Urzì, Sonny Grosso, Abe Vigoda, Julie Gregg, Jeannie Linero, Tony Giorgio, Richard Conte, Gray Frederickson, Joe Spinell, Joe Lo Grippo, Al Martino, Lenny Montana, Angelo Infanti, Joseph Medaglia, Tom Rosqui, Randy Jurgensen, Marlon Brando, Gianni Russo, Don Costello, Victor Rendina, Sal Richards, Franco Citti, Morgana King, Robert Duvall, Salvatore Corsitto, John Cazale",/3bhkrj58Vtu7enYsRolD1fZdja1.jpg,C1
64,64,172,The Godfather Part II,240,8.6,1974-12-20,202,"In the continuing saga of the Corleone crime family, a young Vito Corleone grows up in Sicily and in 1910s New York. In the 1950s, Michael Corleone attempts to expand the family business into Las Vegas, Hollywood and Cuba.","Drama, Crime",Paramount Pictures,United States of America,Francis Ford Coppola,"Gary Kurtz, Gabriella Belloni, Marianna Hill, Ezio Flagello, Francesca De Sapio, Elda Maida, Danny Aiello, Roman Coppola, Julian Voloshin, Troy Donahue, Italia Coppola, Salvatore Po, Larry Guardino, Tom Rosqui, Tom Dahlgren, Richard Matheson, Tito Alba, Robert Duvall, John Cazale, Jay Rasumny, Ignazio Pappalardo, Richard Bright, Johnny Naranjo, Joseph Della Sorte, Mario Cotone, G. D. Spradlin, Gastone Moschin, Saveria Mazzola, Venancia Grangerard, Al Pacino, Amerigo Tot, James Gounaris, Edward Van Sickle, Robert De Niro, Sofia Coppola, Diane Keaton, William Bowers, Michael V. Gazzo, Paul B. Brown, Abe Vigoda, Julie Gregg, Nick Discenza, Joe Lo Grippo, Oreste Baldini, Joe De Nicola, Phil Feldman, Morgana King, Richard Watson, John Megna, Harry Dean Stanton, Vincent Coppola, Filomena Spagnuolo, James Caan, Carmen Argenziano, Tere Livrano, Carmine Foresta, Leopoldo Trieste, Giuseppe Sillato, Fay Spain, Buck Houghton, Joe Spinell, Teresa Tirelli, Livio Giorgi, Erica Yohn, Joseph Medaglia, Gianni Russo, Carmine Caridi, Ivonne Coll, Andrea Maugeri, Lee Strasberg, Kathleen Beller, Bruno Kirby, Frank Sivero, Roger Corman, Talia Shire, Peter LaCorte, Maria Carta, Dominic Chianese, Peter Donat, John Aprea, David Baker, Victor Pujols Faneyte, Sho Kosugi",/hek3koDUyRQk7FIhPXsa6mT2Zc3.jpg,C1
86,86,256,Schindler's List,424,8.565,1993-12-15,195,The true story of how businessman Oskar Schindler saved over a thousand Jewish lives from the Nazis while they worked as slaves in his factory during World War II.,"Drama, History, War",Amblin Entertainment,United States of America,Steven Spielberg,"Beata Paluch, Wojciech Klata, Michael Z. Hoffmann, Danny Marcu, Jochen Nickel, Vili Matula, Maria Peszek, Caroline Goodall, Marcin Grzymowicz, Michael Schiller, Hanna Kossowska, Jeremy Flynn, Tadeusz Huk, Andrzej Welminski, Leopold Pfefferberg, Tomasz Dedek, Grzegorz Damięcki, Elina Löwensohn, Peter Flechtner, Agnieszka Wagner, Henryk Bista, August Schmölzer, Dorit Seadia, Eugeniusz Priwieziencew, Haymon Maria Buttinger, Jerzy Sagan, Hans-Michael Rehberg, Zuzanna Lipiec, Embeth Davidtz, Piotr Cyrwus, Marek Wrona, Wilhelm Manske, Agnieszka Krukówna, Anemona Knut, Lucyna Zabawa, Alexander Buczolich, Tadeusz Bradecki, Ravit Ferera, Ben Kingsley, Adi Nitzan, Maciej Kowalewski, Erwin Leder, Rami Heuberger, Götz Otto, Maja Ostaszewska, Piotr Polk, Martin Bergmann, Jacek Pulanecki, Jacek Wójcicki, Bettina Kupfer, Ludger Pistor, Marta Bizoń, Maciej Orłoś, Zbigniew Kozłowski, Georges Kern, Katarzyna Śmiechowicz, Malgorzata Gebel, Leopold Kozłowski, Hubert Kramar, Harry Nehring, Esti Yerushalmi, Leopold Rosner, Maciej Winkler, Albert Misak, Shabtai Konorti, Alexander Strobele, Stanislaw Koczanowicz, Miri Fabian, Jonathan Sagall, Norbert Weisser, Mark Ivanir, Jerzy Nowak, Marian Glinka, Geno Lechner, Sławomir Holland, Joachim Paul Assböck, Jacek Link-Lenczowski, Emilie Schindler, Krzysztof Luft, Artus-Maria Matthiessen, Daniel Del-Ponte, Osman Ragheb, Ewa Kolasińska-Szramel, Alexander Held, Paweł Deląg, Magdalena Dandourian, Michael Gordon, Branko Lustig, Lech Niebielski, Wolfgang Seidenberg, Ryszard Radwański, Razia Israeli, Beata Deskur, Sigurd Bemme, Edward Linde-Lubaszenko, Liam Neeson, Hans-Jörg Assmann, Oliwia Dabrowska, Wiesław Komasa, Lidia Wyrobiec-Bank, Peter Appiano, Adam Siemion, Beata Rybotycka, Anna Mucha, Radosław Krzyżowski, Jan Jurewicz, Dieter Witting, Michael Schneider, Ralph Fiennes, Thomas Morris, Dariusz Szymaniak, Uri Avrahami, Stanisław Brejdygant, Sebastian Skalski, Sebastian Konrad, Shmuel Levy, Béatrice Macola, Grzegorz Kwas, Dominika Bednarczyk, Agnieszka Korzeniowska, Martin Semmelrogge, Alicja Kubaszewska, Etl Szyc, Hans Rosner, Dirk Bender, Aldona Grochal, Andrzej Seweryn, Magdalena Komornicka, Ezra Dagan, Olaf Lubaszenko, Ruth Farhi, Maciej Kozłowski, Friedrich von Thun, Piotr Kadlcik",/sF1U4EUQS8YHUYjNl3pMGNIQyr0.jpg,C2
43,43,113,The Dark Knight,155,8.516,2008-07-16,152,"Batman raises the stakes in his war on crime. With the help of Lt. Jim Gordon and District Attorney Harvey Dent, Batman sets out to dismantle the remaining criminal organizations that plague the streets. The partnership proves to be effective, but they soon find themselves prey to a reign of chaos unleashed by a rising criminal mastermind known to the terrified citizens of Gotham as the Joker.","Drama, Action, Crime, Thriller",DC,United Kingdom,Christopher Nolan,"Lisa McAllister, Helene Maksoud, Dale Rivera, Joseph Oliveira, Nigel Carrington, Beatrice Rosen, Keith Szarabajka, Paul Birchard, Erron Jay, Chin Han, Erik Hellman, Roger Monk, Grahame Edwards, Gary Oldman, Nathan Gamble, Joseph Luis Caballero, Sofiya Smirnova, Nydia Rodriguez Terracina, Don Kress, Philip Bulcock, Tommy Campbell, Lateef Lovejoy, Matt Rippy, Debbi Burns, Keith Kupferer, Lanny Lutz, Mike Whyte, Daryl Satcher, Joshua Harto, Danny Goldring, Gertrude Kyles, Matt Skiba, Natalie Hallam, Shirin Caiola, David Fultz, Joshua Rollins, Nestor Carbonell, Aidan Feore, Rob Clark, Ron Dean, Rick Avery, Edison Chen, Ronan Summers, John Warman, Robert Stone, Bronson Webb, Amit Shah, Maggie Gyllenhaal, Christian Bale, Andrew Bicknell, Dan Latham, Winston Ellis, Cillian Murphy, Michael Vieau, Brandon Lambdin, Tim Krueger, Kelli Clevenger, Peter Rnic, Peter DeFaria, James Fierro, Olumiji Olawumi, James Mellor, Chris Petschler, Bruce Spielbauer, Melinda McGraw, James Scales, Adam Kalesperis, William Armstrong, Andy Luther, Jonathan Ryland, Morgan Freeman, David Dastmalchian, K. Todd Freeman, David Ajala, Tony Domino, Anthony Michael Hall, Peter Brooke, Patrick Clear, Michael Jai White, Aaron Eckhart, Tristan Tait, Michael Stoyanov, Nicky Katt, Jordon Hodges, Vincent Riotta, Heath Ledger, Monique Gabriela Curnen, Wai Wong, Greg Beam, Thomas Gaitsch, Tom Townsend, John Turk, Hannah Gunn, Michael Corey Foster, Maritza Cabrera, Richard Strobel, Lorna Gayle, Patrick Leahy, Thomas Kosik, Jennifer Knox, Chris Wilson, Ariyon Bakare, Buster Reeves, Ian Pirie, Tina Simmons, Vincenzo Nicoli, Sophia Hinshelwood, Nancy Crane, Jon Lee Brody, Michael Caine, Richard Divizio, Craig Heaney, Charles Venn, Will Zahrn, Richard Dillane, Eric Roberts, Sam Derence, James Farruggio, Craig Braginsky, Kevin Zaideman, Walter Lewis, Colin McFarlane, Tom McElroy, Matthew O'Neill, Matthew Leitch, Doug Ballard, William Fichtner, Michelle Shields, Tommy Lister Jr., Robert Patrick Stern, Laura Chernicky, Ritchie Coster, Tom McComas, Sarah Jayne Dunn, William Smillie, Matt Shallenberger, Henry Milton Chu, Michael Andrew Gorman",/qJ2tW6WMUDux911r6m7haRef0WH.jpg,B2
5,5,16,The Lord of the Rings: The Return of the King,122,8.5,2003-12-17,201,"As armies mass for a final battle that will decide the fate of the world--and powerful, ancient forces of Light and Dark compete to determine the outcome--one member of the Fellowship of the Ring is revealed as the noble heir to the throne of the Kings of Men. Yet, the sole hope for triumph over evil lies with a brave hobbit, Frodo, who, accompanied by his loyal friend Sam and the hideous, wretched Gollum, ventures deep into the very dark heart of Mordor on his seemingly impossible quest to destroy the Ring of Power.​","Adventure, Fantasy, Action",New Line Cinema,New Zealand,Peter Jackson,"Robert Pollock, Ian McKellen, Jed Brophy, Liv Tyler, Dominic Monaghan, Brad Dourif, John Noble, Joseph Mika-Hunt, Alistair Browning, Michael Elsworth, Michael Semanick, Orlando Bloom, Bret McKenzie, Sean Astin, Harry Sinclair, Clint Elvy, Jarl Benzon, Lawrence Makoare, Hugo Weaving, Karl Urban, Zo Hartley, Peter Jackson, Richard Taylor, Sandro Kopp, Sean Bean, Peter Tait, Maisy McLeod-Riera, Bruce Phillips, Sadwyn Brophy, Ross Duncan, Billy Jackson, Pete Smith, Craig Parker, Sala Baker, Cate Blanchett, Shane Rangi, Christian Rivers, John Stephenson, Viggo Mortensen, Todd Rippon, Stephen Ure, Ian Holm, Thomas Robins, Emma Deakin, Sarah McLeod, Joel Tobeck, Bernard Hill, Jason Fitch, Noel Appleby, Andy Serkis, David Aston, Katie Jackson, Jane Abbott, Aidan Bell, Andrew Lesnie, Billy Boyd, John Bach, Henry Mortensen, Jørn Benzon, Howard Shore, Ali Astin, David Wenham, Gino Acevedo, Miranda Otto, Marton Csokas, Rick Porras, Alan Howard, Richard Edge, Lee Hartley, Elijah Wood, Paul Norell, Royd Tolkien, Christopher Lee, Bruce Hopkins, Ian Hughes, John Rhys-Davies",/rCzpDGLbOoPwLjy3OAm5NUPOTrC.jpg,B2
61,61,165,Pulp Fiction,680,8.5,1994-09-10,154,"A burger-loving hit man, his philosophical partner, a drug-addled gangster's moll and a washed-up boxer converge in this sprawling, comedic crime caper. Their adventures unfurl in three stories that ingeniously trip back and forth in time.","Thriller, Crime",Miramax,United States of America,Quentin Tarantino,"Joseph Pilato, Duane Whitaker, Carl Allen, Karen Maruyama, Richard Rossi, John Travolta, Brenda Hillhouse, Susan Griffiths, Brad Blumenthal, Ani Sava, Ving Rhames, Jerome Patrick Hoban, Maria de Medeiros, Bruce Willis, Steve Buscemi, Christopher Walken, Venessia Valentino, Michael Gilden, Bronagh Gallagher, Robert Ruth, Phil LaMarr, Alexis Arquette, Eric Stoltz, Don Blakely, Quentin Tarantino, Peter Greene, Laura Lovelace, Samuel L. Jackson, Rene Beard, Kathy Griffin, Julia Sweeney, Gary Shorelle, Rosanna Arquette, Paul Calderon, Lorelei Leslie, Linda Kaye, Rich Turner, Sy Sher, Stephen Hibbert, Eric Clark, Chandler Lindauer, Lawrence Bender, Cie Allman, Amanda Plummer, Tim Roth, Frank Whaley, Burr Steers, Emil Sitka, Harvey Keitel, Uma Thurman, Angela Jones, Glendon Rich",/d5iIlFn5s0ImszYzBPb8JPIfbXD.jpg,C1
100,100,292,GoodFellas,769,8.5,1990-09-12,145,"The true story of Henry Hill, a half-Irish, half-Sicilian Brooklyn kid who is adopted by neighbourhood gangsters at an early age and climbs the ranks of a Mafia family under the guidance of Jimmy Conway.","Drama, Crime",Winkler Films,United States of America,Martin Scorsese,"Tony Conforti, Samuel L. Jackson, Henny Youngman, Frank Aquilino, Vito Picone, Mikey Black, Tony Sirico, Robbie Vinton, Thomas Lowry, Richard Mullally, Joel Blake, Tony Ellis, Susan Varon, Michael Imperioli, Johnny Williams, Jamie deRoy, Peter Cicale, Melissa Prophet, Beau Starr, Katherine Wallach, Mike Contessa, Vito Antuofermo, Gayle Lewis, Edward McDonald, Jesse Kirtzman, Joanna Bennett, Victor Colicchio, John Di Benedetto, Thomas Hewson, Paul Herman, LoNardo, Joseph D'Onofrio, Frank Adonis, Bob Altman, Jeffrey Rollins, Dominique DeVito, Margo Winkler, Tobin Bell, Joel Calendrillo, Marianne Leone Cooper, Frank Cassini, Frank Vincent, Bob Golub, Illeana Douglas, Margaret Smith, Daniela Barbosa, Mike Starr, Thomas E. Camuti, Joe Gioco, Dino Laudicina, Berlinda Tolbert, Daniel P. Conte, Alyson Jones, Violet Gaynor, Gaetano Lisi, Peter Fain, Chuck Low, Fran McGee, Anthony Caso, Nadine Kay, Michael Calandrino, Frank Pellegrino, Anthony Polemeni, Nicole Burdette, Louis Eppolito, John Manca, Edward D. Murphy, Paul Sorvino, Irving Welzer, Paul McIsaac, Lawrence Sacco, James Quattrochi, Margaux Guerard, Vincent Gallo, Marie Michaels, Lisa Bostnar, John 'Cha Cha' Ciarcia, Joseph Bono, Catherine Scorsese, Christopher Serrone, Gene Canfield, Jerry Vale, Stella Keitel, Russell Halley, Erasmus C. Alfano, Frank Albanese, Julie Garfield, Adam Wandt, Manny Alfaro, Anthony Alessandro, Lisa D’Apolito, Michael Citriniti, Peter Onorati, Charles Scorsese, Spencer Bradley, Tony Darrow, Elaine Kagan, Ray Liotta, Steve Forleo, Welker White, Nancy Cassaro, Frank DiLeo, Lorraine Bracco, Angela Pietropinto, Isiah Whitlock Jr., Richard Dioguardi, Garry Pastore, Paula Kcira, Vincent Pastore, Edward Hayes, Gina Mattia, Norman Barbera, Gaetano LoGiudice, Andrew Scudiero, Larry Silvestri, Michaelangelo Graziano, Bo Dietl, Peter Hock, Debi Mazar, Robert De Niro, Elizabeth Whitcraft, Mark Jacobs, Ruby Gaynor, Vito Balsamo, Kevin Corrigan, Billy L. Sullivan, Joe Pesci, Ed Deacy, H. Clay Dear, Anthony Valentin, Janis Corsair, Luke Walter, Anthony Powers, Paul Mougey, Ronald Maccone, Clem Caserta, Suzanne Shepherd, Tony Lip, Philip Suriano, Frank Sivero, Gina Mastrogiacomo",/aKuFiU82s5ISJpGZp7YkIr3kCUd.jpg,C1
142,142,385,The Green Mile,497,8.5,1999-12-10,189,"A supernatural tale set on death row in a Southern prison, where gentle giant John Coffey possesses the mysterious power to heal people's ailments. When the cell block's head guard, Paul Edgecomb, recognizes Coffey's miraculous gift, he tries desperately to help stave off the condemned man's execution.","Fantasy, Drama, Crime",Castle Rock Entertainment,United States of America,Frank Darabont,"Mack Miles, Brent Briscoe, Dee Croxton, Wes Hall, Jared Stovall, Phil Hawn, Judy Herrera, David Morse, Bonnie Hunt, Edrie Warner, Scotty Leavenworth, Bailey Drucker, Michael Jeter, Rebecca Klingler, David E. Browning, Tommy Barnes, Tom Hanks, Michael Clarke Duncan, Sam Rockwell, Graham Greene, Paula Malcomson, Christopher Joel Ives, Gower Mills, Gary Sinise, Katelyn Leavenworth, Bill Gratton, Van Epperson, Eve Brent, Patricia Clarkson, Barry Pepper, Gary Imhoff, Harry Dean Stanton, Evanne Drucker, Dabbs Greer, Rai Tasco, Jeffrey DeMunn, Doug Hutchison, Todd Thompson, William Sadler, Brian Libby, Rachel Singer, Garth Shaw, James Cromwell, Bill McKinney",/8VG8fDNiy50H4FedGwdSVUPoaJe.jpg,B2
84,84,251,Forrest Gump,13,8.471,1994-06-23,142,"A man with a low IQ has accomplished great things in his life and been present during significant historic events—in each case, far exceeding what anyone imagined he could do. But despite all he has achieved, his one true love eludes him.","Comedy, Drama, Romance",Paramount Pictures,United States of America,Robert Zemeckis,"Juan Singleton, Christopher James Hall, Elvis Presley, Jim Boeke, W. Benson Terry, Jeffrey Winner, Troy Christian, Beau Lotterman, Ronald Reagan, Rob Adams, Bruce Lucvia, Hanna Hall, Todd Adamson, Marlena Smalls, Scott Oliver, Lyndon B. Johnson, Christopher Jones, Jenny Inge Devaney, Peter Bannon, Sally Field, Kevin Davis, Gary Robinson, Clint Calvert, Brendan Shanahan, John Randall, Greg Brown, Ione M. Telech, Neal MacMillan, Michael Satterfield, Aaron Izbicki, John Worsham, Fay Genens, Gary Sinise, Marla Sucharetza, Teresa Denton, Jed Gillin, Hilary Chaplain, Tyler Long, Pete Auster, Conor Kennelly, Frank Geyer, David Brisbin, Jay Ross, Jim Hanks, Lonnie Hamilton, Marcus Batton, Matt Wallace, Michael Mattison, Bob Penny, Vanessa Roth, Ellsworth Hanna, Joe Stefanelli, Richard Nixon, Kenneth Bevington, Keri-Anne Bilotta, Bob Hope, Joe Washington, Dick Clark, Michael Conner Humphreys, Calvin Gadsden, Michael J. Oliver, Jacqueline Lovell, Lenny Herb, Joe Abby, Mykelti Williamson, Natalie Hendrix Tate, Peter Dobson, Darrell O'Cook, Stephen Bridgewater, Mary Ellen Trainor, John Voldstad, Bryan Hanna, Aaron Michael Lacey, Michael Garvey, Mark A. Rich, Nora Dunfee, John Lennon, Joe Alaskey, Markus Alexander, Charles Boswell, Tim Perry, Steven Griffith, Paul Raczkowski, Isabel Rose, Matt Rebenkoff, Dick Stilwell, Leigh Goodoff, Elizabeth Hanks, Timothy Record, Emily Carey, Logan Livingston Gomez, Al Harrington, Sonny Shroyer, Jim Keller, Ed Davis, Siobhan Fallon Hogan, Ben Waddel, Valentine, Daniel Chamblin, Teddy Lane Jr., Kirk Ward, Byron Minns, John F. Kennedy, Timothy McNeil, Jack Bowden, Steve DeRelian, John-Michael Steele, Mark Matheisen, William Shipman, Christine Seabrook, Zhuang Zedong, Russ Isles, Bobby Richardson, George Wallace, Jim Damron, Bonnie Ann Burgess, Don Fischer, John Glenn Harding, Lazarus Jackson, Tiffany Salerno, Harold G. Herthum, Eric Underwood, John Simmit, Russ Wilson, Bill Roberson, John William Galt, Mike Jolly, Paulie DiCocco, Michael Flannery, Haley Joel Osment, Deborah McTeer, Michael Jace, Margo Moorer, Angela Lomas, Kitty K. Green, Brett Rice, James Ent, Michael McFall, Robin Wright, Afemo Omilami, Aloysius Gigl, Andrew Lepper, Ryan Duncan, Daniel C. Striepeke, Sam Anderson, Michael Burgess, Eric Alan Wendell, Rob Landry, Grand L. Bush, Chiffonye Cobb, Geoffrey Blake, Daniel J. Gillooly, Kurt Russell, Darren W. Conrad, Alexander Zemeckis, Arthur Bremer, Robert F. Kennedy, Hallie D'Amore, Danté McCarthy, Robb Skyler, Kevin Mangan, Gerald Ford, Beth Aylward, Jeanne Hanna, Michael Kemmerling, Zach Hanner, Neil Armstrong, Rebecca Williams, Bob Harks, Dick Cavett, John Connally, George Kelly, Grady Bowman, Richard D'Alessandro, Jason McGuire, Tom Hanks",/arw2vcBveWOVZr6pxd9XTd1TdQa.jpg,B1
1,1,9,Interstellar,157336,8.442,2014-11-05,169,The adventures of a group of explorers who make use of a newly discovered wormhole to surpass the limitations on human space travel and conquer the vast distances involved in an interstellar voyage.,"Adventure, Drama, Science Fiction",Legendary Pictures,United Kingdom,Christopher Nolan,"Matthew McConaughey, Jessica Chastain, Mackenzie Foy, Brooke Smith, Andrew Borba, Jeff Hephner, Ryan Irving, Elyes Gabel, Joseph Oliveira, David Oyelowo, Casey Affleck, Flora Nolan, Kristian Van der Heyden, Collette Wolfe, Matt Damon, William Devane, Josh Stewart, Benjamin Hardy, Griffen Fraser, Russ Fega, Timothée Chalamet, Topher Grace, Liam Dickinson, Ellen Burstyn, David Gyasi, Anne Hathaway, Lena Georgas, Wes Bentley, Francis X. McCarthy, Alexander Michael Helisek, Michael Caine, Bill Irwin, Leah Cairns, William Patrick Brown, John Lithgow",/gEU2QniE6E77NI6lCU6MxlNBvIx.jpg,C1
35,35,90,Fight Club,550,8.4,1999-10-15,139,"A ticking-time-bomb insomniac and a slippery soap salesman channel primal male aggression into a shocking new form of therapy. Their concept catches on, with underground ""fight clubs"" forming in every town, until an eccentric gets in the way and ignites an out-of-control spiral toward oblivion.",Drama,Fox 2000 Pictures,Germany,David Fincher,"Ezra Buzzington, David Andrews, Michael Shamus Wiles, Scotch Ellis Loring, Christopher John Fields, Eddie Hargitay, Anderson Bourell, Holt McCallany, Dierdre Downing-Jackson, Charlie Dell, Jared Leto, Lou Beatty Jr., Helena Bonham Carter, Sydney 'Big Dawg' Colston, Todd Peirce, Owen Masterson, Joel Bissonnette, Paul Carafotes, Michael Girardin, David Lee Smith, Trey Ore, Gregory Silva, Robby Robinson, Stuart Blumberg, Van Quattro, Jawara, Eugenie Bondurant, Tyrone R. Livingston, Brian Tochi, Valerie Bickford, David Jean Thomas, Phil Hawn, Jim Jenkins, Baron Jay, Markus Redmond, J.T. Pontino, Christina Cabot, Michael Zagst, Paul Dillon, Pat McNamara, Marc Cinquanta, Peter Iacangelo, Meat Loaf, Eion Bailey, Edward Norton, Matt Cinquanta, Mark Fite, Leonard Termo, Christie Cronenweth, Lauren Sánchez, Zach Grenier, Evan Mirand, Tim DeZarn, Brad Pitt, Greg Bronson, Richmond Arquette, Marcio Rosario, Carl Ciarfalio, Bennie Moore, Joon Kim, Ed Kowalczyk, Bruce Holman, Summer Moore, Kevin Scott Mack, Matt Winston, Louis Ortiz, Rachel Singer, Hugh Peddy, Rob Lanza, Bob Stephenson, Thom Gossom Jr., Andi Carnick, Michael Arturo, George Maguire, Chad Randau",/pB8BM7pdSp6B6Ih7QZ4DrQ3PmJK.jpg,C1
72,72,209,Whiplash,244786,8.4,2014-10-10,107,"Under the direction of a ruthless instructor, a talented young drummer begins to pursue perfection at any cost, even his humanity.","Drama, Music",Bold Films,United States of America,Damien Chazelle,"Tony Baker, J.K. Simmons, Kavita Patil, Herman Johansen, Michelle Ruff, Jayson Blair, Chris Mulkey, Joseph Oliveira, Ayinde Vaughan, Marcus Henderson, Keenan Henson, Rogelio Douglas Jr., April Grace, Candace Roberge, Jimmie Kirkpatrick, Janet Hoskins, Austin Stowell, Keenan Allen, Damon Gupton, Kofi Siriboe, Michael D. Cohen, C.J. Vana, Shai Golan, Charlie Ian, Krista Kilber, Daniel Weidlein, Yancey Wells, Stephen Hsu, Suanne Spoke, Paul Reiser, Sam Campisi, Nate Lang, Henry G. Sanders, Adrian Burks, Melissa Benoist, Max Kasch, Tarik Lowe, Joseph Bruno, Wendee Lee, Tyler Kimball, Calvin C. Winbush, Miles Teller, Jocelyn Ayanna, Clifton 'Fou Fou' Eddie",/7fn624j5lj3xTme2SgiLCeuedmO.jpg,B2
80,80,236,Inception,27205,8.4,2010-07-15,148,"Cobb, a skilled thief who commits corporate espionage by infiltrating the subconscious of his targets is offered a chance to regain his old life as payment for a task considered to be impossible: ""inception"", the implantation of another person's idea into a target's subconscious.","Action, Science Fiction, Adventure",Legendary Pictures,United Kingdom,Christopher Nolan,"Jack Gilroy, Nicole Pulliam, Peter Basham, Joseph Gordon-Levitt, Cillian Murphy, Marc Raducci, Carl Gilliard, Natasha Beaumont, Andrew Pleavin, Russ Fega, Talulah Riley, Lukas Haas, Virgile Bramly, Jill Maddrell, Michael Gaston, Ken Watanabe, Jean-Michel Dagory, Shannon Welles, Lisa Reynolds, Tohoru Masamune, Dileep Rao, Jason Tendell, Coralie Dedykere, Jack Murray, Leonardo DiCaprio, Pete Postlethwaite, Silvie Laguna, Alex Lombard, Daniel Girondeaud, Tai-Li Lee, Taylor Geare, Ryan Hayward, Helena Cullinan, Shelley Lang, Kraig Thornber, Felix Scott, Nicolas Clerc, Marion Cotillard, Magnus Nolan, Claire Geare, Miranda Nolan, Angela Nathenson, Mark Fleischmann, Michael Caine, Adam Cole, Johnathan Geare, Earl Cameron, Elliot Page, Tom Berenger, Tim Kelleher, Tom Hardy, Yuji Okumoto",/ljsZTbVsrQSqZgWeep2B1QiDKuh.jpg,C1
119,119,338,Spider-Man: Into the Spider-Verse,324857,8.4,2018-12-06,117,"Struggling to find his place in the world while juggling school and family, Brooklyn teenager Miles Morales is unexpectedly bitten by a radioactive spider and develops unfathomable powers just like the one and only Spider-Man. While wrestling with the implications of his new abilities, Miles discovers a super collider created by the madman Wilson ""Kingpin"" Fisk, causing others from across the Spider-Verse to be inadvertently transported to his dimension.","Animation, Action, Adventure, Science Fiction",Columbia Pictures,United States of America,"Rodney Rothman, Peter Ramsey, Bob Persichetti","Kelby Joseph, Juan Carlos Arvelo, Oscar Camacho, Melanie Haynes, Joseph Izzo, Marvin 'Krondon' Jones III, Adam Brown, Harrison Knight, Mimi Davila, Nick Jaine, Al Rodrigo, Andrew Leviton, Gredel Berrios Calladine, Darcy Rose Byrnes, June Christopher, Donna Lynn Leavy, Oscar Isaac, Joseph Sanfelippo, Mahershala Ali, Kathryn Hahn, Terrence Hardy Jr., Dennis Singletary, Greta Lee, Liev Schreiber, Lake Bell, Shameik Moore, Zoë Kravitz, Kimiko Glenn, Alycia Cooper, John Mulaney, Scott Menville, Chrystee Pharris, Jacqueline Pinol, Devika Parikh, Christopher Miller, Chris Pine, Jason Linere-White, Courtney Peldon, Bridget Hoffman, Holly Walker, Natalie Morales, David Applebee, Sarah D. Cole, Miguel Jiron, Carlos Zaragoza, Post Malone, Lex Lang, Arthur Ortiz, Lily Tomlin, Claudia Choi, Michelle Jubilee Gonzalez, Joaquín Cosío, Stan Lee, Jake Johnson, Brian Tyree Henry, Nicolas Cage, Justin Shenkarow, Rif Hutton, Jessica Mikayla Adams, Caitlin McKenna, Shakira Ja'nai Paye, Melissa Sturm, Luna Lauren Velez, Jon Bruno, Edwin H. Bravo, Ruth Zalduondo, Warren Sroka, Muneeb Rehman, Jorma Taccone, Juan Pacheco, Juan Pope, Hailee Steinfeld, Kim Yarbrough",/iiZZdoQBEYBv6id8su7ImL0oCbD.jpg,B2
311,311,932,One Flew Over the Cuckoo's Nest,510,8.4,1975-11-19,133,"A petty criminal fakes insanity to serve his sentence in a mental ward rather than prison. He soon finds himself as a leader to the other patients—and an enemy to the cruel, domineering nurse who runs the ward.",Drama,Fantasy Films,United States of America,Miloš Forman,"Tin Welch, Ken Kenny, Philip Roth, Scatman Crothers, Christopher Lloyd, Ted Markland, Nathan George, Mimi Sarkisian, Mel Lambert, Brad Dourif, Audrey Landers, Kay Lee, Delos V. Smith Jr., Josip Elic, Jack Nicholson, Will Sampson, Peter Brocco, William Redfield, Sydney Lassick, William Duell, Louise Fletcher, Mwako Cumbuka, Dean R. Brooks, Danny DeVito, Anjelica Huston, Dwight Marfield, Saul Zaentz, Lan Fendors, Alonzo Brown, Mews Small, Michael Berryman, Vincent Schiavelli, Louisa Moritz, Aurore Clément",/kjWsMh72V6d8KRLV4EOoSJLT1H7.jpg,C1
